STATION_NUMBER,STATION_NAME,PROV_TERR_STATE_LOC,REGIONAL_OFFICE_ID,HYD_STATUS,SED_STATUS,LATITUDE,LONGITUDE,DRAINAGE_AREA_GROSS,DRAINAGE_AREA_EFFECT,RHBN,REAL_TIME,CONTRIBUTOR_ID,OPERATOR_ID,DATUM_ID
02QC007,SAINTE-ANNE (RIVIERE)-3,QC,6,D,,49.0661087036133,-66.4936065673828,786.0,,0,0,740,740,405
02QC008,SAINTE-ANNE (RIVIERE)-2,QC,6,D,,49.0652809143066,-66.4938888549805,786.0,,0,0,740,740,405
02QC009,"SAINTE-ANNE (RIVIERE) À 9,7 KM EN AMONT DU PONT-ROUTE 132",QC,6,A,,49.0588912963867,-66.4866714477539,774.0,,0,1,740,740,405
02QC010,SAINTE-ANNE (RIVIERE) EN AMONT DE LA RIVIERE SAINTE-ANNE NORD-EST,QC,6,D,,48.9463882446289,-66.1272201538086,208.0,,0,0,740,740,405
02QC011,SAINTE-ANNE NORDD-EST (RIVIERE),QC,6,D,,48.9477806091309,-66.1230621337891,177.0,,0,0,740,740,405
02QC012,SAINTE-ANNE (RIVIERE) A LA SORTIE DU LAC SAINTE-ANNE,QC,6,D,,48.8066711425781,-66.063606262207,35.5999984741211,,0,0,740,740,405
02QC013,RENARD (PETIT RIVIERE AU),QC,6,D,,48.9858283996582,-64.4244384765625,64.0,,0,0,740,740,405
02QC014,RENARD (PETITE RIVIERE AU) PRES DE L'EMBOUCHURE,QC,6,D,,48.9749984741211,-64.4358291625977,59.7999992370606,,0,0,647,740,405
02QC017,GRANDE-VALLEE (RIVIERE),QC,6,D,,49.1886100769043,-65.1522216796875,128.0,,0,0,740,740,405
02RA001,BONNARD (RIVIERE) AU RESERVOIR MANOUANE,QC,6,D,,50.7216682434082,-71.0449981689453,5000.0,,0,0,725,725,410
02RB001,MANOUANE (RIVIERE) AU RESERVOIR MANOUANE,QC,6,D,,50.6583290100098,-70.5277786254883,5000.0,,0,0,725,725,410
02RB003,MANOUANICHE (RIVIERE) AU RESERVOIR PIPMUACAN,QC,6,D,,49.5116691589355,-70.9116668701172,13400.0,,0,0,530,530,405
02RB004,MANOUANE (RIVIERE) A LA SORTIE DU LAC DUHAMEL,QC,6,D,,49.8813896179199,-70.9277801513672,3686.0,,0,0,740,740,405
02RC002,PERIBONCA (RIVIERE) A LA CENTRALE DE CHUTE-A-LA-SAVANE,QC,6,D,,48.7541694641113,-71.8399963378906,26900.0,,0,0,725,725,410
02RC003,PERIBONCA (RIVIERE) A LA CENTRALE DE LA PASSE DANGEREUSE,QC,6,D,,49.9000015258789,-71.2541732788086,11000.0,,0,0,725,725,410
02RC005,PERIBONCA (RIVIERE) AU RESERVOIR DE LA PASSE DANGEREUSE,QC,6,D,,49.9000015258789,-71.2541732788086,11000.0,,0,0,725,725,410
02RC007,PERIBONCA (RIVIERE) A LA CENTRALE DE LA CHUTE DU DIABLE,QC,6,D,,48.7808303833008,-71.6975021362305,25600.0,,0,0,725,725,410
02RC008,PERIBONCA (RIVIERE) EN AVAL DE LA CENTRALE CHUTE DU DIABLE,QC,6,D,,48.7808303833008,-71.6975021362305,25600.0,,0,0,725,725,410
02RC009,PERIBONCA (RIVIERE) EN AVAL DE LA CENTRALE DE CHUTE-A-LA-SAVANE,QC,6,D,,48.7541694641113,-71.8399963378906,26900.0,,0,0,725,725,410
02RC010,SERPENT (RIVIERE AU) PRES DE LA RIVIERE PERIBONCA,QC,6,D,,49.6074981689453,-71.2994384765625,2220.0,,0,0,647,740,405
02RC011,PERIBONCA (PETITE RIVIERE),QC,6,A,,48.8141708374023,-72.0477828979492,1090.0,,0,1,647,740,405
02RD002,MISTASSIBI (RIVIERE),QC,6,D,,48.8994407653809,-72.211669921875,9320.0,,0,0,740,740,405
02RD003,MISTASSINI (RIVIERE) EN AMONT DE LA RIVIERE MISTASSIBI,QC,6,A,,48.8877792358398,-72.2636108398438,9870.0,,0,1,740,740,405
02RD006,TICOUAPE (RIVIERE),QC,6,D,,48.8549995422363,-72.4947204589844,295.0,,0,0,740,740,405
02RD007,MISTASSIBI (RIVIÈRE) EN AMONT DE LA CHUTE BOUCHARD,QC,6,A,,48.9425010681152,-72.1725997924805,8743.0,,0,1,740,740,
02RE001,MISTASSINI (RIVIERE) EN AMONT DE LA RIVIERE SAMAQUA,QC,6,D,,49.3188896179199,-72.6380615234375,4480.0,,0,0,740,740,405
02RE002,MISTASSINI (RIVIERE) PRES DE LA RIVIERE SAMAQUA,QC,6,D,,49.1688919067383,-72.5688934326172,4580.0,,0,0,740,740,405
02RE003,OUASIEMSCA (RIVIERE) EN AVAL DE LA RIVIERE MICOSAS,QC,6,D,,49.1025009155274,-72.7324981689453,3320.0,,0,0,740,740,405
02RE004,OUASIEMSCA (RIVIERE),QC,6,D,,49.0005607604981,-72.5047225952148,3420.0,,0,0,740,740,405
02RE006,JIM (LAC A),QC,6,D,,48.9833297729492,-72.7422180175781,1190.0,,0,0,740,740,405
02RF001,ASHUAPMUSHUAN (RIVIERE) À LA TÊTE DE LA CHUTE AUX SAUMONS,QC,6,A,D,48.6863899230957,-72.4880599975586,15300.0,,1,1,647,740,405
02RF002,ASHUAPMUSHUAN (RIVIERE) EN AVAL DE LA RIVIERE DU CHEF,QC,6,D,,49.2763900756836,-73.3566665649414,11100.0,,0,0,740,740,405
02RF006,CHAMOUCHOUANE (RIVIERE) EN AVAL DU PONT DE LA ROUTE NO 167,QC,6,D,,49.2566719055176,-73.7083282470703,4330.0,,0,0,740,740,405
02RF009,SAUMONS (RIVIERE AUX) PRES DE L'EMBOUCHURE,QC,6,A,,48.6836090087891,-72.5138931274414,585.0,,0,1,740,740,
02RF010,ROUGE (RIVIÈRE) EN AMONT DU PONCEAU SUR LA ROUTE 373,QC,6,A,,48.8039016723633,-72.4919967651367,27.0,,0,1,740,740,
02RG002,SAINT-JEAN (LAC) PRES DE SAINT-HENRI-DETAILLON,QC,6,D,,48.6555595397949,-71.8499984741211,73000.0,,0,0,725,725,410
02RG003,SAINT-JEAN (LAC) A SAINT-GEDEON,QC,6,D,,48.538890838623,-71.7805633544922,73000.0,,0,0,725,725,410
02RG005,METABETCHOUANE (RIVIERE) EN AMONT DE LA CENTRALE S.R.P.C.,QC,6,A,,48.375,-71.9936065673828,2280.0,,1,1,740,740,405
02RG006,METABETCHOUANE (RIVIERE) A LA CENTRALE S.R.P.C.,QC,6,D,,48.3755607604981,-71.9794387817383,2300.0,,0,0,543,543,405
02RG007,OUIATCHOUANE (RIVIERE) AU RESERVOIR DES COMMISSAIRES,QC,6,A,,48.2016716003418,-72.2430572509766,562.0,,0,1,740,740,405
02RG008,OUIATCHOUANE (RIVIERE) EN AVAL DU BARRAGE DE LAC DES COMMISSAIRES,QC,6,A,,48.2061080932617,-72.2388916015625,562.0,,0,1,740,740,405
02RG009,BOUCHETTE (LAC),QC,6,D,,48.2622184753418,-72.1944427490234,624.0,,0,0,740,740,405
02RG010,SAINT-JEAN (LAC) A ROBERVAL,QC,6,D,,48.5261116027832,-72.2213897705078,73000.0,,0,0,725,725,410
02RG011,COUCHEPAGANICHE (RIVIERE) PRES DE SON EMBOUCHURE,QC,6,D,,48.4130592346191,-71.8452835083008,94.0,,0,0,740,740,405
02RG012,OUIATCHOUANICHE (RIVIERE),QC,6,D,,48.5355606079102,-72.2694396972656,339.0,,0,0,740,740,405
02RG013,SAINT-JEAN (LAC) A LA POINTE SCOTT,QC,6,D,,48.5261116027832,-72.2297210693359,73000.0,,0,0,725,725,410
02RG014,BEAU PORTAGE (LAC DU),QC,6,D,,48.3680610656738,-71.5736083984375,0.259999990463257,,0,0,740,740,405
02RG015,LOUIS (LAC),QC,6,D,,48.3622207641602,-71.5772171020508,3.20000004768372,,0,0,740,740,405
02RG016,ROND (LAC),QC,6,D,,48.3658294677734,-71.5772171020508,0.259999990463257,,0,0,740,740,405
02RG018,BELLE RIVIERE (RIVIERE LE) PRES D'HEBERTVILLE,QC,6,D,,48.4388885498047,-71.7369384765625,422.0,,0,0,740,740,405
02RG019,OUIQUI (LAC),QC,6,D,,48.3630599975586,-71.5616683959961,0.259999990463257,,0,0,647,740,405
02RG020,SAINT-JEAN (LAC) À ROBERVAL (PRÈS DU CENTRE AQUATIQUE),QC,6,A,,48.5277786254883,-72.2230606079102,71584.0,,0,1,740,740,405
02RH001,SAGUENAY (RIVIERE) A LA CENTRALE D'ISLE MALIGNE,QC,6,D,,48.577220916748,-71.6352767944336,73000.0,,0,0,725,725,410
02RH002,CHICOUTIMI (RIVIERE) AU RESERVOIR KENOGAMI,QC,6,A,,48.3097190856934,-71.2122192382813,3990.0,,0,1,740,740,405
02RH003,SHIPSHAW (RIVIERE) A LA CENTRALE DE MURDOCK-WILSON,QC,6,D,,48.4736099243164,-71.2372207641602,2270.0,,0,0,735,735,405
02RH004,SHIPSHAW (RIVIERE) AU RESERVOIR ONATCHIWAY,QC,6,D,,48.8902816772461,-71.0388870239258,1740.0,,0,0,735,735,405
02RH005,SHIPSHAW (RIVIERE) AU RESERVOIR PIPMUACAN,QC,6,D,,49.3300018310547,-70.9783325195312,277.0,,0,0,735,735,405
02RH006,SHIPSHAW (RIVIERE) A LA CENTRALE DE LA MOTHE,QC,6,D,,48.6986083984375,-71.2127838134766,2030.0,,0,0,735,735,405
02RH008,CHICOUTIMI (RIVIERE) A LA CENTRALE DE LA CIE PRICE,QC,6,D,,48.4263916015625,-71.0769424438477,3500.0,,0,0,735,735,405
02RH011,SHIPSHAW (RIVIERE) A LA CENTRALE DE LA CHUTE AUX GALETS,QC,6,D,,48.6513900756836,-71.2033309936524,2150.0,,0,0,735,735,405
02RH012,SHIPSHAW (RIVIERE) A LA CENTRALE DE BROCHET,QC,6,D,,48.6577796936035,-71.1711120605469,2150.0,,0,0,735,735,405
02RH014,SABLES (RIVIERE AUX) AU RESERVOIR KENOGAMI,QC,6,A,,48.360279083252,-71.2769393920898,3390.0,,0,1,740,740,405
02RH015,CHICOUTIMI (RIVIERE) EN AVAL DU BARRAGE PORTAGE DES ROCHES,QC,6,A,,48.3041687011719,-71.1944427490234,3390.0,,0,1,740,740,405
02RH017,SAGUENAY (RIVIERE) A LA CENTRALE DE LA CHUTE A CARON,QC,6,D,,48.4505615234375,-71.2541732788086,73800.0,,0,0,725,725,410
02RH018,SAGUENAY (RIVIERE) EN AVAL DE LA CHUTE A CARON,QC,6,D,,48.4505615234375,-71.2541732788086,73800.0,,0,0,725,725,410
02RH019,SAGUENAY (RIVIERE) A LA CENTRALE DE SHIPSHAW,QC,6,D,,47.5522193908691,-71.2155609130859,73800.0,,0,0,725,725,410
02RH020,SAGUENAY (RIVIERE) EN AVAL DE LA CENTRALE DE SHIPSHAW,QC,6,D,,47.5522193908691,-71.2155609130859,73800.0,,0,0,725,725,410
02RH023,CHICOUTIMI (RIVIERE) ET RIVIERE AUX SABLES AUX SORTIES DU RES KENOGAMI,QC,6,D,,48.3097190856934,-71.2122192382813,3390.0,,0,0,647,740,405
02RH027,PIKAUBA (RIVIERE) EN AMONT DE LA RIVIERE APICA,QC,6,A,,47.9411087036133,-71.3819427490234,495.0,,0,1,740,740,405
02RH028,CREEK OUTLET,QC,6,D,,48.3547210693359,-71.2527770996094,3990.0,,0,0,740,740,405
02RH029,SABLES (RIVIERE AUX) AU BARRAGE PIBRAC,QC,6,D,,48.3711090087891,-71.2838897705078,3390.0,,0,0,647,740,405
02RH034,ECORCES (RIVIERE AUX)-2,QC,6,D,,48.1822204589844,-71.6452789306641,1110.0,,0,0,740,740,405
02RH035,ÉCORCES (RIVIERE AUX) EN AMONT DU PONT-ROUTE 169,QC,6,A,,48.1822204589844,-71.6452789306641,1110.0,,0,1,740,740,405
02RH045,"VALIN (RIVIERE) À 3,5 KM DE L'EMBOUCHURE",QC,6,A,,48.4888916015625,-70.9741668701172,746.0,,0,1,740,740,405
02RH046,SAINTE-MARGUERITE NORD-EST(RIVIERE) PRES DE LA RIV. STE.MARGUERITE-2,QC,6,D,,48.271671295166,-69.857780456543,1090.0,,0,0,740,740,405
02RH047,SAINTE-MARGUERITE NORD-EST(RIVIERE) PRES DE LA RIV. STE.MARGUERITE-1,QC,6,D,,48.267219543457,-69.9077835083008,1100.0,,0,0,647,740,405
02RH048,HA HA (RIVIERE),QC,6,D,,48.2747192382813,-70.8677825927734,572.0,,0,0,647,740,405
02RH049,PETIT SAGUENAY (RIVIERE),QC,6,D,,48.1861114501953,-70.0505599975586,736.0,,0,0,647,740,405
02RH052,VASES (RIVIERE DES),QC,6,D,,48.4811096191406,-71.190559387207,81.5999984741211,,0,0,740,740,405
02RH053,PETIT BRAS (RIVIERE LE) PRES DE LA RIVIERE DE VASES-1,QC,6,D,,48.4824981689453,-71.2152786254883,11.3999996185303,,0,0,740,740,405
02RH054,PETIT BRAS (RIVIERE LE) PRES DE LA RIVIERE DES VASES-2,QC,6,D,,48.4819412231445,-71.2122192382813,12.0,,0,0,740,740,405
02RH056,MARS (RIVIERE A),QC,6,D,,48.3308296203613,-70.9055633544922,642.0,,0,0,740,740,405
02RH057,BEDARD (RIVIERE),QC,6,D,,48.5286102294922,-71.6930618286133,116.0,,0,0,740,740,405
02RH059,AULNAIES (RIVIERE DES) EN AMONT DE LA RIVIERE LABONTE,QC,6,D,,48.5922203063965,-71.3555603027344,219.0,,0,0,740,740,405
02RH061,SABLES (RIVIERE AUX) EN AVAL DE PIBRAC,QC,6,D,,48.3711090087891,-71.2847213745117,3390.0,,0,0,740,740,
02RH062,PETITE-DECHARGE (LA) A LA SORTIE DU LAC JEAN,QC,6,D,,48.5641708374023,-71.7536087036133,73000.0,,0,0,725,725,405
02RH063,DECHARGE DU PETIT LAC MONCOUCHE,QC,6,D,,48.295280456543,-71.2027816772461,0.479999989271164,,0,0,740,740,
02RH065,BELLE RIVIERE (RIVIERE) EN AMONT DU RUISSEAU DES AULNAIES,QC,6,A,,48.4141693115234,-71.7074966430664,322.0,,0,1,740,740,
02RH066,CYRIAC (RIVIERE) A 9KM EN AMONT DE SON EMBOUCHURE,QC,6,A,,48.235279083252,-71.2897186279297,355.0,,0,1,740,740,
02RH067,PETIT SAGUENAY (RIVIERE) A 1 KM DU RUISSEAU DECHARGE DU LAC DAVID,QC,6,A,,48.0930595397949,-70.029167175293,441.0,,0,1,740,740,405
02RH068,MARS (RIVIERE A) EN AMONT DU BARRAGE ROMÉO-TREMBLAY,QC,6,D,,48.3281517028809,-70.9072113037109,634.0,,0,0,740,740,405
02RH069,À MARS (RIVIÈRE) À LA FOSSE 80 DANS LA ZEC DE LA RIVIÈRE À MARS,QC,6,A,,48.2050018310547,-70.9979019165039,450.0,,0,1,740,740,
02RH070,DU MOULIN (RIVIÈRE) EN AMONT DU SEUIL À L'ENTRÉ DU PARC DU MOULIN,QC,6,A,,48.394401550293,-71.0423965454102,358.0,,0,1,740,740,
02RH071,"PIKAUBA (RIVIÈRE) À 3,6 KM DE L'EMBOUCHURE",QC,6,A,,48.3059005737305,-71.4405975341797,2640.0,,0,1,740,740,
02RH072,SABLES (RIVIÈRE AUX) À SAGUENAY,QC,6,A,,48.3718986511231,-71.2844009399414,3390.0,,0,1,740,740,
02RH073,"SAINTE-MARGUERITE NORD-EST (RIVIÈRE) À 1,7 KM DE LA RIVIÈRE SAINTE-MARGUERITE",QC,6,A,,48.2691993713379,-69.9085998535156,1100.0,,0,1,740,740,
02SB001,BETSIAMITES (RIVIERE) EN AVAL DE LA CENTRALE NO. 2-A,QC,6,D,,49.1830596923828,-69.2013931274414,16100.0,,0,0,530,530,405
02SB002,BETSIAMITES (RIVIERE) AU RESERVOIR PIPMUACAN,QC,6,D,,49.3541717529297,-69.7874984741211,13400.0,,0,0,530,530,410
02SB003,BETSIAMITES (RIVIERE) A LA CENTRALE NO. 1,QC,6,D,,49.3541717529297,-69.7874984741211,13400.0,,0,0,530,530,405
02SB004,BETSIAMITES (RIVIERE) A LA CENTRALE NO.2,QC,6,D,,49.1755599975586,-69.2272186279297,16100.0,,0,0,530,530,405
02SB005,BETSIAMITES (RIVIERE),QC,6,D,,49.1827812194824,-69.2463912963867,16100.0,,0,0,740,740,405
02SB006,BETSIAMITES (RIVIERE) EN AVAL DE LA CENTRALE NO. 2-B,QC,6,D,,49.1755599975586,-69.2272186279297,16100.0,,0,0,530,530,405
02SC001,ESCOUMAINS (RIVIERE DES) A ESCOUMAINS,QC,6,D,,48.3386116027832,-69.4380569458008,793.0,,0,0,740,740,405
02SC002,PORTNEUF (RIVIERE) EN AMONT DES CHUTES PHILIAS,QC,6,D,,48.6616706848145,-69.1669387817383,2010.0,,0,0,647,740,405
02SC003,CASSETTE (RIVIERE A) PRES DE LA RIVIERE DES ESCOUMINS,QC,6,D,,48.4083290100098,-69.5236129760742,40.7000007629395,,0,0,740,740,
02SC004,ESCOUMINS (RIVIERE DES) A ESCOUMINS,QC,6,D,,48.3494415283203,-69.4561080932617,787.0,,0,0,647,740,
02SC005,"ESCOUMINS (RIVIERE DES) À 9,0 KM DE SON EMBOUCHURE",QC,6,A,,48.3708305358887,-69.4722213745117,767.0,,0,1,740,740,405
02TB001,HART JAUNE (RIVIERE) AU RESERVOIR PETIT MANICOUAGAN,QC,6,D,,51.8333282470703,-67.8083267211914,4580.0,,0,0,520,520,405
02TC001,MANICOUAGAN (RIVIERE) A LA CENTRALE MCCORMICK,QC,6,D,,49.2013893127441,-68.3388900756836,45800.0,,0,0,535,535,405
02TC002,TOULNUSTOUC (RIVIERE) AU RESERVOIR STE-ANNE,QC,6,D,,50.1277809143066,-67.9333267211914,7930.0,,0,0,535,535,405
02TC003,MANICOUAGAN (RIVIERE) A LA CENTRALE NO.2,QC,6,D,,49.3349990844727,-68.3475036621094,45600.0,,0,0,530,530,405
02TC004,MANICOUAGAN (RIVIERE) A LA CENTRALE NO. 5,QC,6,D,,50.6444396972656,-68.7249984741211,29300.0,,0,0,530,530,410
02TE001,OUTARDES (RIVIERE AUX) A LA CENTRALE DE CHUTE-AUX-OUTARDES,QC,6,D,,49.1549987792969,-68.4044418334961,18900.0,,0,0,535,535,405
02TE002,OUTARDES (RIVIERE AUX) A LA CENTRALE NO. 4,QC,6,D,,49.7069396972656,-68.9077835083008,17200.0,,0,0,530,530,410
02TE003,OUTARDES (RIVIERE AUX) A LA CENTRALE NO. 3,QC,6,D,,49.5583305358887,-68.720832824707,17900.0,,0,0,530,530,410
02UA001,TRINITE (RIVIERE DE LA) PRES DE SON EMBOUCHURE,QC,6,D,,49.4150009155274,-67.3727798461914,505.0,,0,0,740,740,405
02UA003,"GODBOUT (RIVIERE) À 1,6 KM EN AMONT DU PONT-ROUTE 138",QC,6,A,,49.3305587768555,-67.6558303833008,1570.0,,0,1,740,740,405
02UA006,ANGLAIS (RIVIERE DES) EN AVAL DU PONT-ROUTE 138,QC,6,D,,49.2722206115723,-68.1569366455078,444.0,,0,0,740,740,
02UB001,RAPIDES (RIVIERE DES),QC,6,D,,50.2852783203125,-66.4527816772461,557.0,,0,0,740,740,405
02UB002,SAINTE-MARGUERITE (RIVIERE) A LA CENTRALE DE LA CIE GULF POWER,QC,6,D,,50.2113914489746,-66.6605606079102,6140.0,,0,0,322,322,405
02UC002,"MOISIE (RIVIERE) À 5,1 KM EN AMONT DU PONT DU Q.N.S.L.R.",QC,6,A,,50.3502807617187,-66.1902770996094,19000.0,,1,1,647,740,405
02UC003,PEKANS (RIVIERE AUX),QC,6,D,,52.1888885498047,-66.8913879394531,3390.0,,0,0,740,740,405
02UC004,RATS MUSQUES (RIVIERE AUX) PRES DE LA RIVIERE MATAMEC-1,QC,6,D,,50.2988891601563,-66.0238876342774,164.0,,0,0,740,740,405
02UC005,MATAMEC (RIVIERE),QC,6,D,,50.3416709899902,-65.938606262207,458.0,,0,0,740,740,405
02UC006,MATAMEC (RIVIERE) EN AVAL DE LA RIVIERE AUX RATS MUSQUES,QC,6,D,,50.2933311462402,-65.9633331298828,679.0,,0,0,740,740,405
02UC007,RATS MUSQUES (RIVIERE AUX) PRES DE LA RIVIERE MATAMEC-2,QC,6,D,,50.2988891601563,-66.0238876342774,164.0,,0,0,740,740,405
02VA001,TONNERRE (RIVIERE AU),QC,6,D,,50.2825012207031,-64.7827835083008,684.0,,0,0,740,740,405
02VA002,TONNERRE (RIVIERE AU) PRES DE L'EMBOUCHURE,QC,6,D,,50.2763900756836,-64.7822189331055,684.0,,0,0,647,740,405
02VA003,TONNERRE (RIVIERE AU) EN AMONT DU PONT-ROUTE 138,QC,6,D,,50.3080596923828,-64.7472229003906,676.0,,0,0,740,740,
02VB001,MAGPIE (RIVIERE) PRES DE L'EMBOUCHURE,QC,6,D,,50.3241691589355,-64.4541702270508,7610.0,,0,0,740,740,405
02VB003,MAGPIE (RIVIERE),QC,6,D,,50.377498626709,-64.4258270263672,7590.0,,0,0,740,740,405
02VB004,MAGPIE (RIVIERE) A LA SORTIE DU LAC MAGPIE,QC,6,A,,50.6858291625977,-64.5808334350586,7230.0,,0,1,740,740,405
02VC001,ROMAINE (RIVIERE) AU PONT DE LA Q.I.T.,QC,6,D,,50.3077812194824,-63.622501373291,13000.0,,0,0,647,740,405
02VC002,ROMAINE (RIVIERE) EN AVAL DE LA RIVIERE AUX SAUTERELLES,QC,6,D,,51.767219543457,-63.7183303833008,6550.0,,0,0,740,740,405
02VC003,ROMAINE (RIVIERE) BELOW LAC LAVOIE,NL,7,D,,52.0961112976074,-63.7061080932617,,,0,0,425,647,10
02WA001,NABISIPI (RIVIERE) A 2.4 KM DE L'EMBOUCHURE,QC,6,D,,50.253059387207,-62.2122192382813,2060.0,,0,0,530,530,405
02WA002,AGUANUS (RIVIERE) EN AMONT DE LA RIVIERE DANY,QC,6,D,,50.247501373291,-62.1175003051758,5590.0,,0,0,530,530,405
02WA003,DANY (RIVIERE) PRES DE LA RIVIERE AGUANUS,QC,6,D,,50.2441711425781,-62.1375007629395,151.0,,0,0,740,740,405
02WB001,NATASHQUAN (RIVIERE) PRES DE L'EMBOUCHURE,QC,6,D,,50.1916694641113,-61.5930595397949,16000.0,,0,0,740,740,405
02WB002,NATASHQUAN (RIVIERE) EN AVAL DE LA RIVIERE NATASHQUAN EST,QC,6,D,,51.1416702270508,-61.6111106872559,11600.0,,0,0,740,740,405
02WB003,"NATASHQUAN (RIVIERE) À 0,6 KM EN AVAL DE LA DÉCHARGE DU LAC ALIESTE",QC,6,A,,50.4272193908691,-61.7136116027832,15600.0,,1,1,647,740,
02WC001,ETAMAMIOU (RIVIERE) PRES DE L'EMBOUCHURE,QC,6,D,,50.3836097717285,-59.9908294677734,2950.0,,0,0,647,740,405
02WC002,OLOMAN (RIVIERE) EN AVAL DE LA RIVIERE WABOUCHAGAMOU,QC,6,D,,50.396671295166,-60.4469413757324,5200.0,,0,0,530,530,405
02WD001,HUILE (RIVIERE A L') PRES DE L'EMBOUCHURE,QC,6,D,,49.8013916015625,-63.5730590820313,179.0,,0,0,647,740,405
02WD002,VAUREAL (RIVIERE) PRES DE L'EMBOUCHURE,QC,6,D,,49.5519409179687,-62.6938896179199,150.0,,0,0,740,740,405
02WD003,JUPITER (RIVIERE) AU CAMP SPORTIF JUPITER 24,QC,6,D,,49.6188888549805,-63.439998626709,604.0,,0,0,740,740,405
02XA003,LITTLE MECATINA RIVER ABOVE LAC FOURMONT,NL,7,A,,52.2298088073731,-61.3169403076172,4540.0,,0,1,647,647,10
02XA004,RIVIERE JOIR NEAR PROVINCIAL BOUNDARY,NL,7,D,,52.1638908386231,-60.059440612793,2060.0,,0,0,647,647,10
02XA006,PETIT MECATINA (RIVIERE DU),QC,6,D,,50.7019386291504,-59.5991706848145,19100.0,,0,0,740,740,405
02XA007,PETIT MECATINA (RIVIERE DU) EN AVAL DU LAC BRETON,QC,6,D,,51.8436088562012,-60.1247215270996,12100.0,,0,0,647,740,405
02XA008,"PETIT MECATINA (RIVIERE DU) À 1,0 KM EN AMONT DE LA NÉTAGAMIOU",QC,6,A,,50.6805610656738,-59.5888900756836,19191.0,,0,1,647,740,
02XB001,SAINT-AUGUSTIN (RIVIERE) EN AVAL DE LA RIVIERE A LAMOUCHE,QC,6,D,,51.6124992370605,-58.7024993896484,5750.0,,0,0,740,740,405
02XB002,COXIPI (RIVIERE) A LA SORTIE DU LAC COXIPI,QC,6,D,,51.5022201538086,-58.396110534668,1060.0,,0,0,647,740,405
02XC001,"SAINT-PAUL (RIVIERE) À 0,5 KM DU RUISSEAU CHANION",QC,6,A,,51.7724990844727,-57.5999984741211,6630.0,,1,1,740,740,405
02XD001,BRADOR (RIVIERE) PRES DE L'EMBOUCHURE,QC,6,D,,51.5091705322266,-57.2519416809082,206.0,,0,0,740,740,405
02XD002,NORTH BROOK NEAR RED BAY,NL,7,D,,51.7574996948242,-56.4513893127441,35.5,,0,0,430,647,10
02YA001,STE. GENEVIEVE RIVER NEAR FORRESTERS POINT,NL,7,D,,51.1383285522461,-56.7922210693359,306.0,,0,0,430,647,10
02YA002,BARTLETTS RIVER NEAR ST. ANTHONY,NL,7,A,,51.44921875,-55.6412506103516,33.5999984741211,,0,1,647,647,10
02YC001,TORRENT RIVER AT BRISTOL'S POOL,NL,7,A,,50.6074714660645,-57.151611328125,624.0,,1,1,647,647,10
02YD001,BEAVER BROOK NEAR RODDICKTON,NL,7,D,,50.9141693115234,-56.1572189331055,237.0,,0,0,,,10
02YD002,NORTHEAST BROOK NEAR RODDICKTON,NL,7,A,D,50.9244194030762,-56.1116905212402,200.0,,0,1,647,647,10
02YE001,GREAVETT BROOK ABOVE PORTLAND CREEK POND,NL,7,A,,50.1623115539551,-57.5775299072266,95.6999969482422,,0,1,647,647,10
02YF001,CAT ARM RIVER ABOVE GREAT CAT ARM,NL,7,D,,50.0758285522461,-56.922779083252,611.0,,0,0,,,10
02YF002,CAT ARM RESERVOIR NEAR SPILLWAY,NL,7,A,,50.075611114502,-56.9160003662109,,,0,1,430,647,64
02YG001,MAIN RIVER AT PARADISE POOL,NL,7,A,,49.8106689453125,-57.1594200134277,627.0,,0,1,647,647,10
02YG002,MIDDLE ARM BROOK BELOW FLATWATER POND,NL,7,D,,49.8061103820801,-56.3424987792969,224.0,,0,0,430,647,10
02YH001,BOTTOM CREEK NEAR ROCKY HARBOUR,NL,7,D,,49.5849990844727,-57.9094390869141,33.4000015258789,,0,0,,647,10
02YJ001,HARRYS RIVER BELOW HIGHWAY BRIDGE,NL,7,A,D,48.5758285522461,-58.3626403808594,640.0,,1,1,647,647,10
02YJ002,BLANCHE BROOK NEAR STEPHENVILLE,NL,7,D,,48.5488891601563,-58.5697212219238,120.0,,0,0,430,647,10
02YJ003,PINCHGUT BROOK AT OUTLET OF PINCHGUT LAKE,NL,7,D,,48.8058280944824,-58.0155601501465,119.0,,0,0,430,647,10
02YK001,HUMBER RIVER AT GRAND LAKE OUTLET,NL,7,D,,49.1619415283203,-57.4244384765625,5020.0,,0,0,212,212,10
02YK002,LEWASEECHJEECH BROOK AT LITTLE GRAND LAKE,NL,7,A,,48.6220283508301,-57.9331092834473,470.0,,0,1,647,647,10
02YK003,SHEFFIELD RIVER AT SHEFFIELD LAKE,NL,7,D,,49.336109161377,-56.6324996948242,362.0,,0,0,,,10
02YK004,HINDS BROOK NEAR GRAND LAKE,NL,7,D,,49.0724983215332,-57.1794395446777,529.0,,0,0,,,10
02YK005,SHEFFIELD BROOK NEAR TRANS CANADA HIGHWAY,NL,7,A,,49.3382797241211,-56.6678886413574,391.0,,0,1,647,647,10
02YK006,HINDS BROOK AT HINDS BROOK POWER HOUSE,NL,7,D,,49.0833282470703,-57.2036094665527,651.0,,0,0,425,425,10
02YK007,GLIDE BROOK BELOW GLIDE LAKE,NL,7,D,,49.1138916015625,-57.3691711425781,112.0,,0,0,430,647,10
02YK008,BOOT BROOK AT TRANS-CANADA HIGHWAY,NL,7,A,,49.2666702270508,-57.1040000915527,20.3999996185303,,0,1,430,647,10
02YK009,GRAND LAKE AT MAIN DAM,NL,7,D,,49.1963882446289,-57.2597198486328,,,0,0,430,647,35
02YK010,GRAND LAKE EAST OF GRAND LAKE BROOK,NL,7,A,,48.6685600280762,-58.0840301513672,,,0,1,430,647,64
02YL001,UPPER HUMBER RIVER NEAR REIDVILLE,NL,7,A,,49.242919921875,-57.3602485656738,2110.0,,1,1,647,647,10
02YL002,CORNER BROOK AT WATSONS BROOK POWERHOUSE,NL,7,D,,48.9238891601562,-57.9030609130859,127.0,,0,0,212,212,10
02YL003,HUMBER RIVER AT HUMBER VILLAGE BRIDGE,NL,7,A,,48.9828605651856,-57.7605781555176,7860.0,,0,1,647,647,10
02YL004,SOUTH BROOK AT PASADENA,NL,7,A,,49.0122795104981,-57.6114196777344,58.5,,0,1,430,647,10
02YL005,RATTLER BROOK NEAR MCIVERS,NL,7,A,,49.0583114624023,-58.1051902770996,17.0,,0,1,647,647,10
02YL006,DEER LAKE NEAR PASADENA,NL,7,D,,49.0088882446289,-57.644718170166,,,0,0,,,35
02YL007,DEER LAKE NEAR GENERATING STATION,NL,7,A,,49.1701393127441,-57.4382514953613,,,0,1,430,647,35
02YL008,UPPER HUMBER RIVER ABOVE BLACK BROOK,NL,7,A,,49.6182518005371,-57.2944984436035,471.0,,0,1,647,647,10
02YL009,CORNER BROOK LAKE AT LAKE OUTLET,NL,7,A,,48.8488616943359,-57.8520317077637,,,0,1,430,647,10
02YL010,WEST POND BROOK NEAR CORNER BROOK LAKE,NL,7,D,,48.8086090087891,-57.839168548584,13.1000003814697,,0,0,430,647,10
02YL011,COPPER POND BROOK NEAR CORNER BROOK LAKE,NL,7,D,,48.806640625,-57.7838287353516,12.8999996185303,,0,0,430,647,10
02YL012,STEADY BROOK ABOVE CONFLUENCE TO HUMBER RIVER,NL,7,A,,48.9531898498535,-57.827751159668,77.1999969482422,,0,1,430,647,10
02YM001,INDIAN BROOK AT INDIAN FALLS,NL,7,D,,49.5119400024414,-56.1124992370606,974.0,,0,0,430,647,10
02YM002,INDIAN BROOK DIVERSION TO BIRCHY LAKE,NL,7,D,,49.3716697692871,-56.6205596923828,,,0,0,,,10
02YM003,SOUTH WEST BROOK NEAR BAIE VERTE,NL,7,A,,49.8935317993164,-56.2221412658691,93.1999969482422,,1,1,647,647,10
02YM004,INDIAN BROOK DIVERSION ABOVE BIRCHY LAKE,NL,7,A,,49.3672485351563,-56.6151885986328,238.0,,0,1,430,647,10
02YN001,VICTORIA RIVER BELOW HIGHWAY BRIDGES,NL,7,D,,48.4155616760254,-57.0675010681152,1210.0,,0,0,,,10
02YN002,LLOYDS RIVER BELOW KING GEORGE IV LAKE,NL,7,A,,48.2398109436035,-57.8281402587891,469.0,,0,1,647,647,10
02YN003,STAR BROOK BELOW STAR LAKE,NL,7,D,,48.5794410705566,-57.2280616760254,427.0,,0,0,,647,10
02YN004,STAR BROOK ABOVE STAR LAKE,NL,7,A,,48.627311706543,-57.3113594055176,276.0,,0,1,430,647,10
02YN005,VICTORIA LAKE AT NORTHEAST CONTROL STRUCTURE,NL,7,A,,48.3573303222656,-57.1150817871094,,,0,1,430,647,10
02YO001,EXPLOITS RIVER AT GRAND FALLS,NL,7,D,,48.9305610656738,-55.6686096191406,8390.0,,0,0,7,5,10
02YO002,RATTLING BROOK NEAR NORRIS ARM,NL,7,D,,49.0666694641113,-55.2999992370606,385.0,,0,0,,,10
02YO003,RATTLING BROOK AT RATTLING BROOK POWERHOUSE,NL,7,D,,49.0533294677734,-55.2866706848145,378.0,,0,0,435,435,10
02YO004,SANDY BROOK AT SANDY BROOK POWERHOUSE,NL,7,D,,48.8883285522461,-55.8205604553223,508.0,,0,0,435,435,10
02YO005,EXPLOITS RIVER BELOW STONY BROOK,NL,7,D,,48.9241714477539,-55.6580581665039,8640.0,,0,0,647,647,10
02YO006,PETERS RIVER NEAR BOTWOOD,NL,7,A,,49.1038284301758,-55.3966903686523,177.0,,0,1,647,647,10
02YO007,LEECH BROOK NEAR GRAND FALLS,NL,7,D,,48.9449996948242,-55.8283309936523,88.3000030517578,,0,0,430,647,10
02YO008,GREAT RATTLING BROOK ABOVE TOTE RIVER CONFLUENCE,NL,7,A,,48.8266716003418,-55.5286903381348,773.0,,0,1,647,647,10
02YO009,UNKNOWN RIVER AT LEWISPORTE,NL,7,D,,49.2338905334473,-55.0661087036133,15.5,,0,0,,,10
02YO010,JUNCTION BROOK NEAR BADGER,NL,7,D,,48.9761085510254,-56.0177803039551,61.5999984741211,,0,0,430,647,10
02YO011,EXPLOITS RIVER BELOW NOEL PAULS BROOK,NL,7,A,,48.8443908691406,-56.2696685791016,6300.0,,0,1,647,647,10
02YO012,SOUTHWEST BROOK AT LEWISPORTE,NL,7,A,,49.2160797119141,-55.0519981384277,58.7000007629395,,0,1,647,647,10
02YO013,EXPLOITS RIVER AT BADGER,NL,7,A,,48.9749412536621,-56.0343589782715,6620.0,,0,1,430,647,35
02YO014,TRIBUTARY TO GILL'S POND BROOK,NL,7,A,,48.6405792236328,-56.5278282165527,8.14999961853027,,0,1,430,647,10
02YO015,EAST POND BROOK BELOW EAST POND,NL,7,A,,48.6821098327637,-56.510139465332,52.8899993896484,,0,1,430,647,10
02YO016,EXPLOITS RIVER NEAR MILLERTOWN,NL,7,A,,48.7600784301758,-56.5824203491211,4810.0,,0,1,430,647,10
02YO017,BEOTHUK LAKE AT INDIAN POINT,NL,7,A,,48.7950782775879,-56.5764694213867,,,0,1,430,647,35
02YO018,EXPLOITS RIVER AT CHARLIE EDWARDS POINT,NL,7,A,,48.9432182312012,-55.7923583984375,7810.0,,0,1,430,647,35
02YO019,BADGER BROOK BELOW FOOT BRIDGE,NL,7,A,,48.9809188842773,-56.0318298339844,756.0,,0,1,430,647,35
02YP001,SHOAL ARM BROOK NEAR BADGER BAY,NL,7,D,,49.3716697692871,-55.8122215270996,63.7999992370605,,0,0,430,647,10
02YQ001,GANDER RIVER AT BIG CHUTE,NL,7,A,,49.0162811279297,-54.8506698608398,4450.0,,1,1,647,647,10
02YQ002,GANDER RIVER AT OUTLET OF GANDER LAKE,NL,7,D,,48.9333305358887,-54.8666687011719,4160.0,,0,0,,,
