STATION_NUMBER,STATION_NAME,PROV_TERR_STATE_LOC,REGIONAL_OFFICE_ID,HYD_STATUS,SED_STATUS,LATITUDE,LONGITUDE,DRAINAGE_AREA_GROSS,DRAINAGE_AREA_EFFECT,RHBN,REAL_TIME,CONTRIBUTOR_ID,OPERATOR_ID,DATUM_ID
01AA002,DAAQUAM (RIVIERE) EN AVAL DE LA RIVIERE SHIDGEL,QC,6,D,,46.5574989318848,-70.0811080932617,598.0,,0,0,740,740,405
01AD001,MADAWASKA (RIVIÈRE) À 6 KM EN AVAL DU BARRAGE TÉMISCOUATA,QC,6,D,,47.5483283996582,-68.6363906860352,2690.0,,0,0,647,740,405
01AD002,SAINT JOHN RIVER AT FORT KENT,ME,7,A,,47.2580604553223,-68.595832824707,14700.0,,1,0,647,600,42
01AD003,ST. FRANCIS RIVER AT OUTLET OF GLASIER LAKE,NB,7,A,,47.2066116333008,-68.9569396972656,1350.0,,1,1,647,647,10
01AD004,SAINT JOHN RIVER AT EDMUNDSTON,NB,7,A,,47.3607788085937,-68.3248901367188,15500.0,,0,1,647,647,35
01AD005,MADAWASKA (RIVIERE) AU RESERVOIR TEMISCOUATA,QC,6,D,,47.5705604553223,-68.6430587768555,2590.0,,0,0,530,530,405
01AD008,LONG (LAC) PRES DE LES ETROITS,QC,6,D,,47.3908309936523,-68.8983306884766,108.0,,0,0,740,740,405
01AD009,CABANO (RIVIERE) AU LAC LONG,QC,6,D,,47.4644393920898,-69.0019378662109,172.0,,0,0,740,740,405
01AD012,SAINT-FRANCOIS (RIVIERE) EN AVAL DU LAC SAINT-FRANCOIS,QC,6,D,,47.7247200012207,-69.283332824707,58.5999984741211,,0,0,740,740,405
01AD013,SAINT-FRANCOIS (RIVIERE) EN AVAL DU LAC SAINT-FRANCOIS,QC,6,D,,47.7191696166992,-69.2838897705078,59.7999992370606,,0,0,740,740,405
01AD014,POHENEGAMOOK (LAC) A ESTCOURT,QC,6,D,,47.4599990844727,-69.2255630493164,389.0,,0,0,740,740,405
01AD015,MADAWASKA (RIVIÈRE) À 6 KM EN AVAL DU BARRAGE TÉMISCOUATA,QC,6,A,,47.538501739502,-68.591796875,2712.0,,0,1,740,740,
01AE001,FISH RIVER NEAR FORT KENT,ME,7,A,,47.2374992370605,-68.5827789306641,2260.0,,0,0,647,600,42
01AF002,SAINT JOHN RIVER AT GRAND FALLS,NB,7,A,,47.0388908386231,-67.7397232055664,21900.0,,0,1,647,647,35
01AF003,GREEN RIVER NEAR RIVIERE-VERTE,NB,7,D,,47.3349990844727,-68.1350021362305,1150.0,,0,0,,647,10
01AF006,BLACK BROOK NEAR ST-ANDRE-DE-MADAWASKA,NB,7,D,D,47.0913887023926,-67.7313919067383,14.1999998092651,,0,0,,,10
01AF007,GRANDE RIVIERE AT VIOLETTE BRIDGE,NB,7,A,D,47.2469711303711,-67.9212799072266,339.0,,0,1,647,647,10
01AF008,SAINT JOHN RIVER AT THE FALLS AT GRAND FALLS,NB,7,D,,47.0513916015625,-67.7386093139648,,,0,0,,,35
01AF009,IROQUOIS RIVER AT MOULIN MORNEAULT,NB,7,A,,47.4578285217285,-68.3568267822266,182.0,,0,1,400,647,10
01AF010,GREEN RIVER AT DEUXIEME SAULT,NB,7,D,,47.4705581665039,-68.2355575561523,1030.0,,0,0,145,145,10
01AF011,LITTLE RIVER NEAR GRAND FALLS,NB,7,D,,47.0719413757324,-67.7077789306641,380.0,,0,0,,647,10
01AG002,LIMESTONE STREAM AT FOUR FALLS,NB,7,D,,46.8283309936523,-67.7430572509766,199.0,,0,0,647,647,10
01AG003,AROOSTOOK RIVER NEAR TINKER,NB,7,A,,46.8163604736328,-67.7519683837891,6060.0,,0,1,647,647,10
01AH001,TOBIQUE RIVER AT ARTHURETTE,NB,7,D,,46.7966690063477,-67.4813919067383,4140.0,,0,0,,,
01AH002,TOBIQUE RIVER AT RILEY BROOK,NB,7,A,,47.1730308532715,-67.210807800293,2230.0,,0,1,400,647,10
01AH003,TOBIQUE RIVER AT PLASTER ROCK,NB,7,D,,46.9049987792969,-67.3949966430664,3130.0,,0,0,,647,10
01AH004,TOBIQUE RIVER AT NARROWS,NB,7,D,,46.7916717529297,-67.6833267211914,4330.0,,0,0,405,405,10
01AH005,MAMOZEKEL RIVER NEAR CAMPBELL RIVER,NB,7,D,,47.2508316040039,-67.142219543457,230.0,,0,0,,,10
01AJ001,SAINT JOHN RIVER NEAR EAST FLORENCEVILLE,NB,7,D,,46.4700012207031,-67.5897216796875,34200.0,,0,0,,647,35
01AJ002,SAINT JOHN RIVER AT WOODSTOCK,NB,7,D,,46.1563911437988,-67.5736083984375,,,0,0,405,405,10
01AJ003,MEDUXNEKEAG RIVER NEAR BELLEVILLE,NB,7,A,,46.2162208557129,-67.7279434204102,1210.0,,0,1,400,647,10
01AJ004,BIG PRESQUE ISLE STREAM AT TRACEY MILLS,NB,7,A,,46.4383583068848,-67.7384414672852,484.0,,1,1,647,647,10
01AJ005,SAINT JOHN RIVER AT HARTLAND,NB,7,D,,46.3061103820801,-67.5325012207031,,,0,0,,,35
01AJ006,HOLMES BROOK AT MOOSE MOUNTAIN,NB,7,D,D,46.6127815246582,-67.6105575561523,7.76999998092651,,0,0,,,10
01AJ007,HOLMES BROOK NEAR HOLMESVILLE,NB,7,D,D,46.5761108398438,-67.5952835083008,31.2999992370605,,0,0,,,10
01AJ008,SAINT JOHN RIVER AT HARTLAND SALMON POOL,NB,7,D,,46.2983283996582,-67.529167175293,,,0,0,,647,35
01AJ009,SAINT JOHN RIVER AT SIMONDS,NB,7,D,,46.3375015258789,-67.5552825927734,35000.0,,0,0,,647,35
01AJ010,BECAGUIMEC STREAM AT COLDSTREAM,NB,7,A,D,46.3408889770508,-67.4651107788086,350.0,,1,1,400,647,10
01AJ011,COLD STREAM AT COLDSTREAM,NB,7,D,,46.3422203063965,-67.4691696166992,156.0,,0,0,,647,10
01AJ012,SAINT JOHN RIVER AT BEECHWOOD GENERATING STATION,NB,7,D,,46.5400009155273,-67.6711120605469,33700.0,,0,0,405,405,10
01AJ013,LITTLE PRESQUE ISLE STREAM NEAR WATERVILLE,NB,7,D,,46.2722206115723,-67.5699996948242,130.0,,0,0,,647,10
01AK001,SHOGOMOC STREAM NEAR TRANS CANADA HIGHWAY,NB,7,A,,45.943531036377,-67.3203582763672,234.0,,1,1,647,647,10
01AK002,SAINT JOHN RIVER AT POKIOK,NB,7,D,,45.9666709899902,-67.2416687011719,38900.0,,0,0,,,
01AK003,SAINT JOHN RIVER AT FREDERICTON,NB,7,A,,45.9661903381348,-66.651611328125,,,0,1,400,647,35
01AK004,SAINT JOHN RIVER BELOW MACTAQUAC,NB,7,D,D,45.9622192382813,-66.8308334350586,39900.0,,0,0,,647,35
01AK005,MIDDLE BRANCH NASHWAAKSIS STREAM NEAR ROYAL ROAD,NB,7,D,D,46.0349998474121,-66.7013931274414,26.8999996185303,,0,0,,647,10
01AK006,MIDDLE BRANCH NASHWAAKSIS STREAM AT SANDWITH'S FARM,NB,7,A,,46.0828094482422,-66.7330322265625,5.69999980926514,,0,1,647,647,10
01AK007,NACKAWIC STREAM NEAR TEMPERANCE VALE,NB,7,A,,46.0487785339356,-67.2396087646484,240.0,,0,1,400,647,10
01AK008,EEL RIVER NEAR SCOTT SIDING,NB,7,D,,45.9366683959961,-67.5469436645508,531.0,,0,0,,647,10
01AK009,SAINT JOHN RIVER AT MACTAQUAC GENERATING STATION,NB,7,D,,45.9566688537598,-66.8647232055664,,,0,0,,647,35
01AK010,SAINT JOHN RIVER AT MACTAQUAC GENERATING STATION,NB,7,D,,45.9566688537598,-66.8647232055664,39900.0,,0,0,405,405,10
01AL001,NASHWAAK RIVER AT PENNIAC,NB,7,D,,46.0091705322266,-66.5830612182617,1660.0,,0,0,400,400,10
01AL002,NASHWAAK RIVER AT DURHAM BRIDGE,NB,7,A,D,46.125919342041,-66.6113128662109,1450.0,,0,1,647,647,35
01AL003,HAYDEN BROOK NEAR NARROWS MOUNTAIN,NB,7,D,,46.2988891601563,-67.0369415283203,6.48000001907349,,0,0,,647,10
01AL004,NARROWS MOUNTAIN BROOK NEAR NARROWS MOUNTAIN,NB,7,A,D,46.2771682739258,-67.0213928222656,3.89000010490417,,1,1,647,647,10
01AL005,"NARROWS MOUNTAIN BROOK, BRANCH NO.1, NEAR NARROWS MOUNTAIN",NB,7,D,,46.2769393920898,-67.0436096191406,0.800000011920929,,0,0,,,10
01AL006,"NARROWS MOUNTAIN BROOK, BRANCH NO.2, NEAR NARROWS MOUNTAIN",NB,7,D,,46.2769393920898,-67.043327331543,0.910000026226044,,0,0,,,10
01AL007,"NARROWS MOUNTAIN BROOK, BRANCH NO.3, NEAR NARROWS MOUNTAIN",NB,7,D,,46.2794418334961,-67.0363922119141,0.409999996423721,,0,0,,,10
01AL008,NASHWAAK RIVER AT STANLEY,NB,7,D,,46.2830581665039,-66.7375030517578,641.0,,0,0,,647,10
01AM001,NORTH BRANCH OROMOCTO RIVER AT TRACY,NB,7,A,,45.6737785339355,-66.6828918457031,557.0,,0,1,647,647,10
01AN001,CASTAWAY STREAM NEAR CASTAWAY,NB,7,D,,46.2983283996582,-65.7119369506836,34.4000015258789,,0,0,,647,10
01AN002,SALMON RIVER AT CASTAWAY,NB,7,A,,46.2907218933106,-65.7227478027344,1050.0,,0,1,400,647,10
01AO001,SAINT JOHN RIVER AT OROMOCTO,NB,7,D,,45.8555603027344,-66.4722213745117,,,0,0,,,10
01AO002,SAINT JOHN RIVER AT MAUGERVILLE,NB,7,A,,45.8664703369141,-66.4531707763672,,,0,1,400,647,35
01AO003,GRAND LAKE AT NEWCASTLE CREEK,NB,7,A,,46.0564002990723,-66.0056991577148,,,0,1,400,647,35
01AO004,JEMSEG RIVER AT JEMSEG,NB,7,A,,45.8289184570313,-66.1154174804688,,,0,1,647,647,35
01AO009,BURPEE MILLSTREAM NEAR FERNMOUNT,NB,7,D,,45.9566688537598,-66.311393737793,93.1999969482422,,0,0,,647,10
01AO010,FRENCH LAKE AT LAKEVILLE CORNER,NB,7,A,,45.9088287353516,-66.2564392089844,,,0,1,400,647,35
01AO011,SAINT JOHN RIVER AT UPPER GAGETOWN,NB,7,A,,45.8472518920898,-66.23486328125,,,0,1,400,647,35
01AO012,SAINT JOHN RIVER AT GAGETOWN,NB,7,A,,45.768669128418,-66.1403579711914,,,0,1,400,647,35
01AP001,KENNEBECASIS RIVER AT NORTON,NB,7,D,,45.6358299255371,-65.7016677856445,1210.0,,0,0,,,
01AP002,CANAAN RIVER AT EAST CANAAN,NB,7,A,,46.0723609924316,-65.3663864135742,668.0,,1,1,400,647,10
01AP003,SAINT JOHN RIVER AT OAK POINT,NB,7,A,,45.5194206237793,-66.0766067504883,,,0,1,400,647,35
01AP004,KENNEBECASIS RIVER AT APOHAQUI,NB,7,A,D,45.7013893127441,-65.601692199707,1100.0,,1,1,647,647,35
01AP005,SAINT JOHN RIVER AT SAINT JOHN,NB,7,A,,45.2733917236328,-66.0888900756836,,,0,1,925,647,35
01AP006,NEREPIS RIVER NEAR FOWLERS CORNER,NB,7,A,,45.5034408569336,-66.3189697265625,293.0,,0,1,225,647,10
01AP009,PARLEE BROOK BELOW ARNOLDS BRIDGE,NB,7,D,,45.6725006103516,-65.418327331543,35.4000015258789,,0,0,,647,10
01AP010,OTNABOG STREAM ABOVE OTNABOG LAKE,NB,7,D,,45.7055015563965,-66.1920013427734,,,0,0,917,647,10
01AQ001,LEPREAU RIVER AT LEPREAU,NB,7,A,,45.1697807312012,-66.4682769775391,239.0,,1,1,647,647,10
01AQ002,MAGAGUADAVIC RIVER AT ELMCROFT,NB,7,A,,45.2733306884766,-66.8066711425781,1420.0,,0,1,647,647,10
01AQ003,WEST MUSQUASH RIVER AT MUSQUASH,NB,7,D,,45.188060760498,-66.3516693115234,210.0,,0,0,405,405,
01AQ004,EAST MUSQUASH RIVER AT MUSQUASH,NB,7,D,,45.204719543457,-66.3261108398438,179.0,,0,0,405,405,
01AQ005,MAGAGUADAVIC RIVER AT SECOND FALLS,NB,7,D,,45.2316703796387,-66.8433303833008,1540.0,,0,0,,,
01AQ006,LITTLE LEPREAU RIVER NEAR LEPREAU,NB,7,D,,45.1391716003418,-66.4483337402344,38.2999992370605,,0,0,,,10
01AQ007,MAGAGUADAVIC LAKE NEAR UPPER MAGAGUADAVIC,NB,7,A,,45.7197494506836,-67.1835632324219,,,0,1,400,647,35
01AQ008,PISKAHEGAN STREAM NEAR PLEASANT MOUNTAIN,NB,7,D,,45.4180603027344,-66.8869400024414,197.0,,0,0,,647,10
01AQ009,LAKE UTOPIA AT CANAL,NB,7,D,,45.1602783203125,-66.8277816772461,,,0,0,,647,35
01AR001,DENNIS STREAM AT MOORES MILLS,NB,7,D,,45.292781829834,-67.272216796875,62.2000007629395,,0,0,,,
01AR002,EEL BROOK NEAR NORTH HEAD,NB,7,D,,44.791389465332,-66.7813873291016,2.84999990463257,,0,0,,,
01AR003,ST. CROIX RIVER NEAR BAILEYVILLE,NB,7,D,,45.2652816772461,-67.4766693115234,3420.0,,0,0,,,10
01AR004,ST. CROIX RIVER AT VANCEBORO,ME,7,A,,45.5688896179199,-67.4297180175781,1080.0,,0,0,647,600,42
01AR005,ST. CROIX RIVER AT BARING,ME,7,A,,45.1366691589355,-67.3180618286133,3550.0,,0,0,647,600,42
01AR006,DENNIS STREAM NEAR ST. STEPHEN,NB,7,A,D,45.2090301513672,-67.2621536254883,115.0,,0,1,400,647,10
01AR007,BOCABEC RIVER AT OUTLET OF KERR LAKE,NB,7,D,,45.2075004577637,-67.0194396972656,12.3999996185303,,0,0,,,
01AR008,BOCABEC RIVER ABOVE TIDE,NB,7,D,,45.1930618286133,-66.998893737793,43.0,,0,0,,,10
01AR009,GRAND LAKE AT FOREST CITY,ME,7,A,,45.6648902893066,-67.7358932495117,,,0,1,1006,647,42
01AR010,SPEDNIC LAKE AT ST. CROIX,NB,7,A,,45.569221496582,-67.4272537231445,,,0,1,1006,647,35
01AR011,FOREST CITY STREAM BELOW FOREST CITY DAM,ME,7,A,,45.6641693115234,-67.7335586547852,357.0,,0,1,1006,647,42
01AR012,CHAMCOOK STREAM AT LITTLE CHAMCOOK LAKE OUTLET,NB,7,D,,45.1572189331055,-67.0961074829102,,,0,0,,647,10
01AR013,GRAND FALLS FLOWAGE AT GRAND FALLS,ME,7,A,,45.2743225097656,-67.4796371459961,,,0,1,1006,647,42
01AR014,ST. CROIX RIVER AT MILLTOWN DAM,NB,7,A,,45.175220489502,-67.2929000854492,,,0,1,647,647,63
01BA001,RESTIGOUCHE RIVER ABOVE KEDGWICK RIVER,NB,7,D,,47.6563911437988,-67.4941711425781,1570.0,,0,0,,,10
01BC001,RESTIGOUCHE RIVER BELOW KEDGWICK RIVER,NB,7,A,,47.6670799255371,-67.4830780029297,3160.0,,1,1,400,647,10
01BD001,MATAPEDIA (RIVIERE) EN AMONT DE LA RIVIERE ASSEMETQUAGAN,QC,6,D,,48.0844383239746,-67.0986099243164,2770.0,,0,0,740,740,405
01BD002,MATAPEDIA (RIVIERE) EN AMONT DE LA RIVIERE ASSEMETQUAGAN,QC,6,D,D,48.086669921875,-67.1005630493164,2760.0,,0,0,647,740,405
01BD004,MATAPEDIA (LAC) A VAL-BRILLANT,QC,6,D,,48.5338897705078,-67.5455627441406,558.0,,0,0,740,740,405
01BD005,LAC AU SAUMON,QC,6,D,,48.4211082458496,-67.3241729736328,1210.0,,0,0,740,740,405
01BD008,MATAPEDIA (RIVIERE) PRES DE AMQUI,QC,6,A,,48.4916687011719,-67.4499969482422,558.0,,0,1,740,740,405
01BD009,MATAPEDIA (RIVIERE) A 4 KM EN AMONT DE L'ASSEMETQUAGAN,QC,6,A,,48.1078987121582,-67.1302032470703,2756.0,,0,1,740,740,405
01BE001,UPSALQUITCH RIVER AT UPSALQUITCH,NB,7,A,,47.8324699401856,-66.887077331543,2270.0,,1,1,647,647,10
01BF001,NOUVELLE (RIVIERE) AU PONT,QC,6,D,,48.1572189331055,-66.3494415283203,1140.0,,0,0,647,740,405
01BF002,NOUVELLE (RIVIERE) EN AVAL DU PONT,QC,6,D,,48.1355590820313,-66.3194427490234,1160.0,,0,0,740,740,405
01BF003,NOUVELLE (RIVIERE) EN AMONT DU PONT,QC,6,D,,48.1616706848145,-66.3802795410156,867.0,,0,0,740,740,405
01BF004,"NOUVELLE (RIVIÈRE) A 0,2 KM EN AMONT DU PONT-ROUTE 132 A NOUVELLE",QC,6,A,,48.1587982177734,-66.3488006591797,1139.0,,0,1,740,740,
01BG001,CASCAPEDIA (PETITE RIVIERE) EN AMONT DU PONT,QC,6,D,,48.1891708374023,-65.8119430541992,1390.0,,0,0,740,740,405
01BG002,BONAVENTURE (RIVIERE) EN AMONT DU PONT,QC,6,D,,48.0999984741211,-65.461669921875,2150.0,,0,0,740,740,405
01BG003,CASCAPEDIA (RIVIERE) EN AVAL DU LAC CASCAPEDIA,QC,6,D,,48.666389465332,-66.1894378662109,1480.0,,0,0,740,740,405
01BG004,CASCAPEDIA (RIVIERE) EN AMONT DE LA RIVIERE ANGERS,QC,6,D,,48.3177795410156,-65.9725036621094,2400.0,,0,0,740,740,405
01BG005,CASCAPEDIA (RIVIERE) EN AVAL DU RUISSEAU BERRY,QC,6,A,,48.6283302307129,-66.1680603027344,1680.0,,0,1,740,740,405
01BG006,BASTIEN (RUISSEAU) EN AMONT DU PONT,QC,6,D,D,48.1097183227539,-66.1269378662109,12.3999996185303,,0,0,740,740,405
01BG007,CHALEURS (BAIE DES) A CARLETON,QC,6,D,,48.0902786254883,-66.1161117553711,,,0,0,740,740,405
01BG008,CASCAPEDIA (PETITE RIVIERE) A SAINT-EDGAR,QC,6,A,,48.2308311462402,-65.7350006103516,1340.0,,0,1,740,740,405
01BG009,BONAVENTURE (RIVIERE) EN AMONT DU RUISSEAU CREUX,QC,6,A,,48.1861114501953,-65.5586090087891,1910.0,,0,1,740,740,
01BG010,CASCAPÉDIA (PETITE RIVIÈRE) À 0.9 KM RIVE DROITE AVAL  PONT-ROUTE À SAINT-EDGAR,QC,6,D,,48.2322998046875,-65.7341003417969,1340.0,,0,0,740,740,
01BH001,DARTMOUTH (RIVIERE) PRES DE CORTEREAL,QC,6,D,,48.9330596923828,-64.6355590820312,748.0,,0,0,740,740,405
01BH002,YORK (RIVIERE) A SUNNY BANK,QC,6,D,D,48.834171295166,-64.625,1010.0,,0,0,740,740,405
01BH003,PORPHYRE (RUISSEAU),QC,6,D,,48.9458312988281,-65.4894409179687,30.2000007629395,,0,0,740,740,405
01BH005,DARTMOUTH (RIVIERE) EN AMONT DU RUISSEAU DU PAS DE DAME,QC,6,A,,48.9797210693359,-64.6986083984375,645.0,,1,1,647,740,405
01BH007,GRANDE-RIVIERE OUEST (LA),QC,6,D,,48.4777793884277,-64.5286102294922,534.0,,0,0,647,740,405
01BH008,SAINT-JEAN (RIVIERE),QC,6,D,,48.771671295166,-64.5213928222656,1090.0,,0,0,740,740,405
01BH009,YORK RIVIERE) EN AMONT DU RUISSEAU D'ARGENT,QC,6,D,,48.8316688537598,-64.6849975585937,972.0,,0,0,740,740,405
01BH010,"YORK (RIVIERE) À 1,4 KM EN AVAL DU RUISSEAU DINNER ISLAND",QC,6,A,,48.8066711425781,-64.9211120605469,659.0,,0,1,740,740,405
01BH011,YORK (RIVIERE) EN AVAL DU RUISSEAU DES ETROITS,QC,6,D,,48.7983283996582,-64.9477767944336,637.0,,0,0,740,740,
01BH012,SAINT-JEAN (RIVIERE) EN AMONT DU PONT-ROUTE 132,QC,6,D,,48.7688903808594,-64.5149993896484,1090.0,,0,0,740,740,
01BJ001,TETAGOUCHE RIVER NEAR WEST BATHURST,NB,7,D,,47.6558303833008,-65.6936111450195,363.0,,0,0,,647,10
01BJ002,EEL RIVER AT EEL RIVER CROSSING,NB,7,D,,48.0130615234375,-66.4233322143555,100.0,,0,0,,,
01BJ003,JACQUET RIVER NEAR DURHAM CENTRE,NB,7,A,,47.8938102722168,-66.0252227783203,510.0,,1,1,647,647,10
01BJ004,EEL RIVER NEAR EEL RIVER CROSSING,NB,7,D,,48.0144386291504,-66.4383316040039,88.5999984741211,,0,0,,,10
01BJ006,LITTLE RIVER AT CARROLL'S FARM,NB,7,D,,47.5675010681152,-65.7019424438477,,,0,0,,,10
01BJ007,RESTIGOUCHE RIVER ABOVE RAFTING GROUND BROOK,NB,7,A,,47.9086685180664,-66.9480590820313,7740.0,,0,1,647,647,10
01BJ008,MILLSTREAM RIVER AT ROBERTVILLE,NB,7,D,,47.7022209167481,-65.7763900756836,105.0,,0,0,,,
01BJ009,WALKER BROOK AT CAMPBELLTON,NB,7,D,,47.9880599975586,-66.6969375610352,60.7999992370606,,0,0,,647,10
01BJ010,MIDDLE RIVER NEAR BATHURST,NB,7,A,D,47.6083908081055,-65.721809387207,217.0,,0,1,400,647,10
01BJ011,NIGADOO RIVER NEAR ALCIDA,NB,7,D,,47.7400016784668,-65.8127822875977,123.0,,0,0,,647,10
01BJ012,EEL RIVER NEAR DUNDEE,NB,7,A,,47.9878883361816,-66.490608215332,43.2000007629395,,0,1,647,647,10
01BK001,NEPISIGUIT RIVER AT BATHURST MINES,NB,7,D,,47.3888893127441,-65.8272171020508,1810.0,,0,0,,,
01BK002,NEPISIGUIT RIVER AT NEPISIGUIT NARROWS,NB,7,D,,47.3619384765625,-65.8450012207031,1790.0,,0,0,,,
01BK003,NEPISIGUIT RIVER AT NEPISIGUIT FALLS,NB,7,D,,47.4066696166992,-65.7949981689453,1840.0,,0,0,405,405,10
01BK004,NEPISIGUIT RIVER NEAR PABINEAU FALLS,NB,7,D,,47.4944381713867,-65.6805572509766,2090.0,,0,0,,,10
01BK005,FORTY MILE BROOK AT CARIBOU DEPOT,NB,7,D,,47.5677795410156,-66.2850036621094,14.1999998092651,,0,0,,,10
01BK006,FORTY MILE BROOK (WEST BRANCH) AT CARIBOU DEPOT,NB,7,D,,47.559440612793,-66.2783279418945,13.0,,0,0,,,10
01BL001,BASS RIVER AT BASS RIVER,NB,7,D,,47.6500015258789,-65.5777816772461,175.0,,0,0,,647,10
01BL002,RIVIERE CARAQUET AT BURNSVILLE,NB,7,A,,47.7056083679199,-65.155387878418,173.0,,1,1,400,647,10
01BL003,BIG TRACADIE RIVER AT MURCHY BRIDGE CROSSING,NB,7,A,,47.4357795715332,-65.1060562133789,383.0,,0,1,647,647,10
01BO001,SOUTHWEST MIRAMICHI RIVER AT BLACKVILLE,NB,7,A,D,46.7360000610352,-65.8256072998047,5050.0,,1,1,647,647,10
01BO002,RENOUS RIVER AT MCGRAW BROOK,NB,7,D,D,46.8213882446289,-66.1147232055664,611.0,,0,0,,647,10
01BO003,BARNABY RIVER BELOW SEMIWAGAN RIVER,NB,7,D,D,46.8886108398438,-65.5955581665039,484.0,,0,0,,647,10
01BO004,BARTIBOG RIVER BELOW HIGHWAY NO. 8,NB,7,D,,47.1908302307129,-65.3974990844727,316.0,,0,0,,647,10
01BP001,LITTLE SOUTHWEST MIRAMICHI RIVER AT LYTTLETON,NB,7,A,D,46.9359703063965,-65.9073867797852,1340.0,,1,1,647,647,10
01BP002,CATAMARAN BROOK AT REPAP ROAD BRIDGE,NB,7,A,,46.856559753418,-66.1901092529297,28.7000007629395,,0,1,647,647,10
01BQ001,NORTHWEST MIRAMICHI RIVER AT TROUT BROOK,NB,7,A,D,47.0947494506836,-65.8365020751953,948.0,,1,1,647,647,10
01BQ002,LITTLE SOUTH BRANCH TOMOGONOPS RIVER AT FRESH WATER POND,NB,7,D,,47.295280456543,-66.0650024414062,,,0,0,,647,10
01BQ003,LITTLE SOUTH BRANCH TOMOGONOPS RIVER BELOW B PIT,NB,7,D,,47.2911109924316,-66.0427780151367,,,0,0,,647,10
01BQ006,SOUTH BRANCH TOMOGONOPS RIVER NEAR HEATH STEEL MINES,NB,7,D,,47.2547187805176,-65.9672164916992,,,0,0,,647,10
01BQ007,TOMOGONOPS RIVER AT THE MOUTH,NB,7,D,,47.2330589294434,-65.8361129760742,158.0,,0,0,,,10
01BR001,KOUCHIBOUGUAC RIVER NEAR VAUTOUR,NB,7,D,,46.7433280944824,-65.204719543457,177.0,,0,0,,647,10
01BS001,COAL BRANCH RIVER AT BEERSVILLE,NB,7,A,D,46.4439392089844,-65.06494140625,166.0,,1,1,647,647,10
01BT001,KINNEAR RIVER NEAR HAUTE-ABOUJAGANE,NB,7,D,,46.1527786254883,-64.3850021362305,32.0999984741211,,0,0,,647,10
01BU001,PETITCODIAC RIVER NEAR SALISBURY,NB,7,D,,46.0166702270508,-65.0666732788086,746.0,,0,0,,,
01BU002,PETITCODIAC RIVER NEAR PETITCODIAC,NB,7,A,D,45.9463882446289,-65.1681900024414,391.0,,1,1,647,647,10
01BU003,TURTLE CREEK AT TURTLE CREEK,NB,7,D,,45.9594993591309,-64.8779983520508,129.0,,0,0,400,647,10
01BU004,PALMERS CREEK NEAR DORCHESTER,NB,7,D,D,45.8872184753418,-64.5163879394531,34.2000007629395,,0,0,,,10
01BU005,HAYWARD BROOK SITE NO. 1 NEAR PETITCODIAC,NB,7,D,D,45.8652801513672,-65.1580581665039,4.30000019073486,,0,0,647,647,10
01BU006,HAYWARD BROOK SITE NO. 4 NEAR PETITCODIAC,NB,7,D,D,45.878059387207,-65.1805572509766,1.37000000476837,,0,0,647,647,10
01BU007,HAYWARD BROOK SITE NO. 5 NEAR PETITCODIAC,NB,7,D,D,45.8713912963867,-65.1849975585938,6.48999977111816,,0,0,647,647,10
01BU008,HAYWARD BROOK SITE NO. 6 NEAR PETITCODIAC,NB,7,D,D,45.8730583190918,-65.1877822875977,2.33999991416931,,0,0,647,647,10
01BU009,HOLMES BROOK SITE NO. 9 NEAR PETITCODIAC,NB,7,A,,45.8878593444824,-65.1467819213867,6.19999980926514,,0,1,647,647,10
01BU013,PETITCODIAC RIVER ABOVE TURTLE CREEK,NB,7,D,,46.0480613708496,-64.896110534668,,,0,0,647,647,35
01BU014,PETITCODIAC RIVER AT DOVER,NB,7,D,,45.9900016784668,-64.6833267211914,,,0,0,647,647,35
01BU015,PETITCODIAC RIVER NEAR BEAUMONT,NB,7,D,,45.8713912963867,-64.5663909912109,,,0,0,647,647,35
01BV001,MISPEC STREAM AT BLACK RIVER ROAD CROSSING,NB,7,D,,45.2702789306641,-65.8952789306641,137.0,,0,0,,,
01BV002,KINNIE BROOK AT FUNDY NATIONAL PARK,NB,7,D,,45.6116714477539,-64.9633331298828,6.48000001907349,,0,0,,,10
01BV003,UPPER SALMON RIVER AT ALMA,NB,7,D,,45.6100006103516,-64.9583282470703,181.0,,0,0,,,10
01BV004,BLACK RIVER AT GARNET SETTLEMENT,NB,7,A,,45.3065795898438,-65.8492202758789,40.4000015258789,,0,1,400,647,10
01BV005,RATCLIFFE BROOK BELOW OTTER LAKE,NB,7,D,,45.3677787780762,-65.8116683959961,29.2999992370605,,0,0,,,10
01BV006,POINT WOLFE RIVER AT FUNDY NATIONAL PARK,NB,7,A,,45.5585594177246,-65.0159683227539,130.0,,1,1,647,647,10
01BV007,UPPER SALMON RIVER NEAR ALMA,NB,7,D,,45.6111106872559,-64.9561080932617,181.0,,0,0,,,10
01BV008,BIG SALMON RIVER NEAR ST. MARTINS,NB,7,D,,45.4241714477539,-65.4116668701172,287.0,,0,0,,,10
01BV009,IMPOUNDMENT B AT NEW HORTON,NB,7,D,,45.6974983215332,-64.6947174072266,0.5,,0,0,,647,10
01BV010,DICKSON BROOK AT FUNDY NATIONAL PARK,NB,7,D,,45.5914192199707,-64.9570617675781,8.8100004196167,8.8100004196167,0,0,647,647,35
01CA001,CARRUTHERS BROOK NEAR HOWLAN,PE,7,D,,46.735279083252,-64.2249984741211,38.7999992370605,,0,0,,,10
01CA002,TROUT RIVER NEAR TYNE VALLEY,PE,7,D,,46.5633316040039,-63.939998626709,22.1000003814697,,0,0,,,10
01CA003,CARRUTHERS BROOK NEAR ST. ANTHONY,PE,7,A,,46.7441101074219,-64.1869964599609,46.7999992370605,,1,1,647,647,10
01CA004,SMELT CREEK NEAR ELLERSLIE,PE,7,D,D,46.6016693115234,-63.9372215270996,17.2999992370605,,0,0,,,10
01CA005,MIMINEGASH RIVER AT ST. LAWRENCE,PE,7,D,,46.848331451416,-64.1977767944336,31.7999992370605,,0,0,,647,10
01CB001,DUNK RIVER AT ROGERS MILL,PE,7,D,,46.3422203063965,-63.6111106872559,98.5999984741211,,0,0,,,10
01CB002,DUNK RIVER AT WALL ROAD,PE,7,A,D,46.3458595275879,-63.6333312988281,114.0,,0,1,647,647,10
01CB003,PLAT RIVER AT SHERBROOKE,PE,7,D,,46.4233283996582,-63.7772216796875,4.51000022888184,,0,0,,,10
01CB004,WILMOT RIVER NEAR WILMOT VALLEY,PE,7,A,D,46.393310546875,-63.6593894958496,45.4000015258789,,0,1,647,647,10
01CB005,NORTH BROOK NEAR WALL ROAD,PE,7,D,D,46.3469390869141,-63.6327781677246,12.8999996185303,,0,0,,,10
01CB006,EMERALD BROOK NEAR EMERALD,PE,7,D,D,46.3594398498535,-63.5580596923828,5.59000015258789,,0,0,,647,10
01CB007,EAST BRANCH DUNK RIVER AT ELLIOTT,PE,7,D,D,46.3630599975586,-63.4633293151856,10.6999998092651,,0,0,,,10
01CB008,DUNK RIVER NEAR BREADALBANE,PE,7,D,D,46.3516693115234,-63.4883308410645,19.7999992370605,,0,0,,,10
01CB009,DUNK RIVER AT MCKENNA'S BRIDGE,PE,7,D,D,46.3525009155273,-63.5422210693359,53.0999984741211,,0,0,,,10
01CB010,DAMES BROOK NEAR NEWTON,PE,7,D,D,46.3469390869141,-63.5552787780762,16.2000007629395,,0,0,,,10
01CB011,DUNK RIVER ABOVE SCALES POND,PE,7,D,D,46.3486099243164,-63.5777816772461,80.5999984741211,,0,0,,,10
01CB012,ELMO RIVER NEAR SCALES POND,PE,7,D,D,46.3386116027832,-63.5977783203125,7.90000009536743,,0,0,,,10
01CB013,DUNK RIVER BELOW SCALES POND,PE,7,D,D,46.3433303833008,-63.6111106872559,98.5999984741211,,0,0,,,10
01CB014,SOUTHWEST BROOK NEAR MIDDLETON,PE,7,D,D,46.3347206115723,-63.6341705322266,23.3999996185303,,0,0,,,10
01CB015,CAPE TRAVERSE RIVER AT CARLETON,PE,7,D,,46.2566719055176,-63.6555595397949,6.8899998664856,,0,0,,647,
01CB018,BARBARA WEIT STREAM AT CAVENDISH FARM,PE,7,A,,46.4275016784668,-63.680419921875,11.6000003814697,,0,1,515,647,10
01CC001,HUNTER RIVER AT HUNTER RIVER,PE,7,D,,46.3597183227539,-63.3458290100098,41.5,,0,0,,,10
01CC002,WINTER RIVER NEAR SUFFOLK,PE,7,A,,46.3320617675781,-63.0654716491699,37.5,,0,1,135,647,10
01CC003,WINTER RIVER AT BRACKLEY WELLS PUMPING STATION,PE,7,D,,46.314998626709,-63.146671295166,4.92000007629395,,0,0,,,10
01CC004,WRIGHTS CREEK NEAR AVONLEA ROAD,PE,7,D,,46.2758293151856,-63.1119384765625,2.41000008583069,,0,0,,,10
01CC005,WEST RIVER AT RIVERDALE,PE,7,A,D,46.2313919067383,-63.3510818481445,70.0999984741211,,1,1,647,647,10
01CC006,CLYDE RIVER NEAR CLYDE RIVER,PE,7,D,,46.2355613708496,-63.2608299255371,26.7999992370605,,0,0,,647,
01CC007,CLARKS CREEK AT AUGUSTUS,PE,7,D,,46.3202781677246,-62.8838882446289,39.7999992370605,,0,0,,647,
01CC008,GLEN FINNAN RIVER AT TARANTUM,PE,7,D,,46.2874984741211,-62.9519386291504,24.0,,0,0,,647,
01CC009,HORNES CREEK AT MARSHFIELD,PE,7,D,,46.2972183227539,-63.0780601501465,5.90000009536743,,0,0,,647,
01CC010,WINTER RIVER AT UNION,PE,7,A,,46.314811706543,-63.1233596801758,16.7999992370605,,0,1,135,647,10
01CC011,COLES CREEK AT MILTONVALE PUMPING STATION,PE,7,A,,46.3102493286133,-63.1948890686035,6.90999984741211,,0,1,135,647,10
01CD001,MORELL RIVER AT MORELL,PE,7,D,,46.3283309936523,-62.6991691589356,133.0,,0,0,,,10
01CD002,MORELL RIVER AT PEAKES ROAD,PE,7,D,,46.3175010681152,-62.6994400024414,129.0,,0,0,,647,10
01CD003,MORELL RIVER AT BANGOR,PE,7,D,,46.3611106872559,-62.7005615234375,147.0,,0,0,,647,10
01CD004,BOUGHTON RIVER NEAR UPTON,PE,7,D,,46.3419418334961,-62.5313911437988,22.8999996185303,,0,0,,,10
01CD005,BEAR RIVER AT ST. MARGARETS,PE,7,A,,46.4531402587891,-62.3823318481445,14.8000001907349,,0,1,647,647,10
01CE001,VERNON RIVER AT GLENCO ROAD CROSSING,PE,7,D,,46.1994400024414,-62.8233299255371,16.7999992370605,,0,0,,,10
01CE002,MONTAGUE RIVER (NORTH BRANCH) ABOVE MONTAGUE POWERHOUSE,PE,7,D,,46.1494407653809,-62.6972198486328,49.5999984741211,,0,0,,,10
01CE003,BRUDENELL RIVER NEAR BRUDENELL,PE,7,D,D,46.2005615234375,-62.6494407653809,36.0,,0,0,,,10
01CE004,BRUDENELL RIVER AT BRUDENELL,PE,7,D,D,46.2019386291504,-62.6563911437988,33.0999984741211,,0,0,,647,10
01CE005,MONTAGUE RIVER NEAR HEAD OF MONTAGUE,PE,7,D,,46.1552810668945,-62.7261085510254,44.4000015258789,,0,0,,647,10
01CE006,CARDIGAN RIVER ABOVE CARDIGAN,PE,7,D,,46.2383308410645,-62.6563911437988,21.3999996185303,,0,0,,,10
01DA001,METEGHAN RIVER NEAR METEGHAN RIVER,NS,7,D,,44.2161102294922,-66.1172180175781,167.0,,0,0,455,647,10
01DB001,SISSIBOO RIVER NEAR WEYMOUTH,NS,7,D,,44.4197196960449,-65.9069366455078,596.0,,0,0,,,10
01DB002,BEAR RIVER EAST BRANCH AT BEAR RIVER,NS,7,D,,44.5666694641113,-65.6333312988281,193.0,,0,0,,,10
