STATION_NUMBER,STATION_NAME,PROV_TERR_STATE_LOC,REGIONAL_OFFICE_ID,HYD_STATUS,SED_STATUS,LATITUDE,LONGITUDE,DRAINAGE_AREA_GROSS,DRAINAGE_AREA_EFFECT,RHBN,REAL_TIME,CONTRIBUTOR_ID,OPERATOR_ID,DATUM_ID
05LN006,BURNT LAKE DRAIN NORTHWEST OF LUNDAR,MB,4,A,,50.7207794189453,-98.0756683349609,420.0,,0,1,1020,647,10
05LN805,LAKE FRANCIS NEAR ST. LAURENT,MB,4,A,,50.3572196960449,-97.9447174072266,374.0,,0,0,1020,1020,35
05MA001,SPRING CREEK NEAR WYNYARD,SK,8,D,,51.7733306884766,-104.11499786377,57.5,31.6000003814697,0,0,,,
05MA002,LITTLE QUILL LAKE NEAR WYNYARD,SK,8,A,,51.8743095397949,-104.132667541504,4490.0,1840.0,0,1,1010,647,35
05MA003,BIG QUILL LAKE NEAR QUILL LAKE,SK,8,D,,51.9538917541504,-104.264167785645,,3370.0,0,0,,,10
05MA004,RANCH LAKE NEAR LENORE LAKE,SK,8,D,,52.4713897705078,-104.788063049316,,164.0,0,0,,,10
05MA005,BIG QUILL LAKE NEAR WYNYARD,SK,8,D,,51.8197212219238,-104.233329772949,,3370.0,0,0,,,10
05MA007,PONASS LAKE NEAR PONASS LAKE,SK,8,D,,52.2355613708496,-103.98999786377,,116.0,0,0,,,10
05MA008,PONASS CREEK NEAR PONASS LAKE,SK,8,D,,52.1883316040039,-103.986389160156,250.0,116.0,0,0,,,10
05MA010,BIG QUILL LAKE NEAR KANDAHAR,SK,8,A,,51.7813682556152,-104.324478149414,8760.0,3370.0,0,1,647,647,35
05MA011,BIRCH CREEK NEAR ELFROS,SK,8,A,,51.7464714050293,-103.874496459961,692.0,305.0,0,1,1010,647,605
05MA012,IRONSPRING CREEK NEAR WATSON,SK,8,A,,52.0568313598633,-104.49983215332,588.0,217.0,0,1,1010,647,10
05MA013,RANCH CREEK NEAR ANNAHEIM,SK,8,D,,52.3180618286133,-104.832496643066,40.4000015258789,17.6000003814697,0,0,,,
05MA014,RANCH CREEK NEAR ANNAHEIM,SK,8,D,,52.3458290100098,-104.811111450195,69.6999969482422,40.7000007629395,0,0,,,10
05MA015,WYNYARD CREEK NEAR THE MOUTH,SK,8,D,,51.7958297729492,-104.222778320313,62.2000007629395,48.4000015258789,0,0,555,555,
05MA016,ROMANCE CREEK NEAR WATSON,SK,8,A,,51.993968963623,-104.553916931152,506.0,80.8000030517578,0,1,647,647,10
05MA017,WYNYARD CREEK NEAR WYNYARD,SK,8,D,,51.7213897705078,-104.189720153809,26.3999996185303,13.1999998092651,0,0,555,555,
05MA018,DAFOE BROOK NEAR DAFOE,SK,8,D,,51.7508316040039,-104.513061523438,106.0,58.7999992370605,0,0,555,555,
05MA019,WIMMER BROOK NEAR WIMMER,SK,8,D,,52.0561103820801,-104.39582824707,152.0,67.9000015258789,0,0,555,555,
05MA020,QUILL CREEK NEAR QUILL LAKE,SK,8,A,,52.013671875,-104.250389099121,273.0,89.5999984741211,0,1,1010,647,10
05MA021,MAGNUSSON CREEK NEAR WYNYARD,SK,8,A,,51.8142204284668,-104.205307006836,121.0,86.0,1,1,1010,647,10
05MA022,BECKETT BROOK NEAR FOAM LAKE,SK,8,D,,51.6583290100098,-103.603332519531,632.0,116.0,0,0,,,10
05MA023,MILLIGAN CREEK NEAR WADENA,SK,8,D,,51.8569412231445,-103.77693939209,1430.0,465.0,0,0,556,556,10
05MA024,RANCH LAKE NEAR ST. JAMES,SK,8,D,,52.4780616760254,-104.767219543457,,164.0,0,0,556,556,35
05MA025,RANCH CREEK ABOVE RANCH LAKE,SK,8,A,,52.4055290222168,-104.789253234863,170.0,87.0,0,1,647,647,10
05MB001,YORKTON CREEK NEAR EBENEZER,SK,8,A,,51.380500793457,-102.504722595215,2320.0,410.0,0,1,1010,647,10
05MB002,WHITESAND RIVER NEAR KAMSACK,SK,8,D,,51.5638885498047,-101.925003051758,9660.0,2340.0,0,0,,,
05MB003,WHITESAND RIVER NEAR CANORA,SK,8,A,D,51.6362190246582,-102.369812011719,8740.0,2000.0,0,1,1010,647,605
05MB004,WHITESAND RIVER NEAR SHEHO,SK,8,D,,51.5927810668945,-103.043891906738,1840.0,270.0,0,0,,,10
05MB005,WILLOW BROOK AT WILLOWBROOK,SK,8,A,,51.2055587768555,-102.801391601563,402.0,95.3000030517578,0,1,1010,1010,10
05MB006,CROOKED HILL CREEK NEAR CANORA,SK,8,A,,51.663330078125,-102.428062438965,582.0,104.0,0,0,1010,1010,10
05MB007,SPIRIT CREEK NEAR BUCHANAN,SK,8,A,,51.7099990844727,-102.80583190918,259.0,104.0,0,0,1010,1010,10
05MB008,WHITESAND RIVER NEAR SPRINGSIDE,SK,8,D,,51.3972206115723,-102.736671447754,2650.0,656.0,0,0,556,647,10
05MB009,THEODORE RESERVOIR NEAR THEODORE,SK,8,D,,51.4422187805176,-102.838890075684,2440.0,546.0,0,0,556,556,35
05MB010,GOOD SPIRIT LAKE NEAR CANORA,SK,8,A,,51.5019416809082,-102.653610229492,820.0,405.0,0,0,1010,1010,35
05MB011,VAN PATTENS CREEK NEAR KUROKI,SK,8,D,,51.8675003051758,-103.586387634277,113.0,85.0,0,0,,,10
05MB012,LAWRIE CREEK NEAR INSINGER,SK,8,D,,51.4880599975586,-103.019439697266,190.0,109.0,0,0,,,10
05MB013,FISHING LAKE NEAR WADENA,SK,8,A,,51.8474998474121,-103.515556335449,634.0,407.0,0,0,1010,1010,35
05MB014,YORK LAKE NEAR YORKTON,SK,8,A,,51.166389465332,-102.496940612793,546.0,145.0,0,0,1010,1010,35
05MC001,ASSINIBOINE RIVER AT STURGIS,SK,8,A,,51.9397201538086,-102.546943664551,1930.0,1140.0,0,1,1010,647,10
05MC002,STONY CREEK NEAR STENEN,SK,8,A,,51.8827781677246,-102.330001831055,254.0,153.0,0,0,1010,1010,10
05MC003,LILIAN RIVER NEAR LADY LAKE,SK,8,A,,52.0227813720703,-102.625,229.0,153.0,0,1,1010,647,10
05MC004,CONJURING CREEK NEAR PREECEVILLE,SK,8,D,,51.9416694641113,-102.716667175293,255.0,143.0,0,0,556,556,10
05MD001,SHELL RIVER AT ASESSIPPI,MB,4,D,,50.9472198486328,-101.316673278809,1980.0,,0,0,,,
05MD002,SHELL RIVER NEAR DUCK LAKE,MB,4,D,,51.1694412231445,-101.327781677246,1650.0,,0,0,,,
05MD004,ASSINIBOINE RIVER AT KAMSACK,SK,8,A,D,51.5648918151855,-101.916557312012,13000.0,4320.0,0,1,647,647,10
05MD005,SHELL RIVER NEAR INGLIS,MB,4,A,,50.9633407592773,-101.318771362305,1970.0,,0,1,647,647,179
05MD006,LITTLE BOGGY CREEK NEAR COTE,SK,8,D,,51.517219543457,-101.782501220703,248.0,127.0,0,0,,,
05MD007,SHELL RIVER NEAR ROBLIN,MB,4,A,,51.3619194030762,-101.256217956543,1320.0,,0,1,1020,647,10
05MD009,LAKE OF THE PRAIRIES NEAR SHELLMOUTH,MB,4,A,,50.9603805541992,-101.41242980957,17900.0,,0,1,1020,647,35
05MD010,STONY CREEK NEAR KAMSACK,SK,8,A,D,51.3889694213867,-101.838966369629,461.0,116.0,0,1,1010,647,10
05MD011,LAKE OF THE PRAIRIES NEAR ROBLIN,MB,4,A,,51.2306900024414,-101.524688720703,15279.900390625,,0,1,1020,647,35
05MD801,ASSINIBOINE RIVER AT SHELLMOUTH BRIDGE,MB,4,A,,50.9324989318848,-101.48388671875,18300.0,,0,0,1020,1020,174
05MD802,WEST BLUE LAKE AT WEST BLUE LAKE,MB,4,A,,51.6069412231445,-100.919441223145,17.8999996185303,,0,0,1020,1020,35
05MD804,CHILDS LAKE NEAR BOGGY CREEK,MB,4,A,,51.5766716003418,-101.116310119629,67.3000030517578,,0,0,1020,1020,35
05ME001,ASSINIBOINE RIVER NEAR RUSSELL,MB,4,A,D,50.8100509643555,-101.435363769531,19400.0,,0,1,1020,647,129
05ME002,BIRDTAIL CREEK AT BIRTLE,MB,4,D,,50.4208297729492,-101.044441223145,1390.0,,0,0,,,
05ME003,BIRDTAIL CREEK NEAR BIRTLE,MB,4,A,,50.5347290039063,-100.952491760254,1100.0,,0,1,1020,647,179
05ME005,CONJURING CREEK NEAR RUSSELL,MB,4,A,,50.7951393127441,-101.29923248291,70.4000015258789,,0,1,1020,647,179
05ME006,ASSINIBOINE RIVER NEAR MINIOTA,MB,4,A,,50.1106109619141,-101.037940979004,84200.0,,0,1,1020,647,181
05ME007,SMITH CREEK NEAR MARCHWELL,SK,8,A,,50.8328285217285,-101.578750610352,435.0,57.7999992370606,0,1,1010,647,10
05ME008,MINNEWASTA CREEK NEAR BEULAH,MB,4,D,,50.2750015258789,-101.015281677246,452.0,,0,0,390,647,181
05ME009,SCISSOR CREEK NEAR MCAULEY,MB,4,A,,50.2696685791016,-101.384246826172,205.0,,0,1,1020,647,10
05ME010,SILVER CREEK NEAR BINSCARTH,MB,4,A,,50.6229400634766,-101.256416320801,457.0,,0,1,1020,647,10
05ME011,ASSINIBOINE RIVER SOUTHWEST OF ST. LAZARE,MB,4,A,,50.4422187805176,-101.31861114502,80100.0,,0,1,1020,647,35
05ME012,ASSINIBOINE RIVER WEST OF RUSSELL,MB,4,D,,50.7663612365723,-101.43724822998,19400.0,,0,0,647,647,200
05ME802,ASSINIBOINE RIVER NEAR ST. LAZARE,MB,4,D,,50.4436111450195,-101.313331604004,80100.0,,0,0,390,390,35
05ME803,SPEAR LAKE NEAR RUSSELL,MB,4,A,,50.7997207641602,-101.325828552246,77.4000015258789,,0,0,1020,1020,35
05MF001,LITTLE SASKATCHEWAN RIVER NEAR MINNEDOSA,MB,4,A,,50.3588104248047,-99.9075317382812,2610.0,,0,1,1020,647,181
05MF003,LITTLE SASKATCHEWAN RIVER AT RIVERDALE,MB,4,D,,50.1902809143066,-99.966667175293,3160.0,,0,0,,,
05MF004,LITTLE SASKATCHEWAN RIVER AT MIDDLETON BRIDGE,MB,4,D,,50.6944389343262,-100.245826721191,657.0,,0,0,,,10
05MF005,LITTLE SASKATCHEWAN RIVER AT ELPHINSTONE,MB,4,D,,50.5319404602051,-100.294441223145,1160.0,,0,0,,,
05MF006,CLEAR CREEK NEAR THE MOUTH,MB,4,D,,50.6833305358887,-100.199996948242,268.0,,0,0,,,
05MF007,ROLLING RIVER NEAR DANVERS,MB,4,D,,50.5555610656738,-99.9027786254883,406.0,,0,0,,,
05MF008,ROLLING RIVER NEAR ERICKSON,MB,4,A,,50.5233116149902,-99.9461364746094,749.0,,0,1,1020,647,181
05MF009,WHIRLPOOL RIVER AT DANVERS,MB,4,D,,50.5638885498047,-99.8916702270508,214.0,,0,0,,,
05MF018,LITTLE SASKATCHEWAN RIVER NEAR RIVERS,MB,4,A,,50.023609161377,-100.207748413086,3888.0,,0,1,1020,647,35
05MF019,CLEAR LAKE AT WASAGAMING,MB,4,D,,50.6652793884277,-99.9763870239258,146.0,109.0,0,0,494,647,129
05MF020,LAKE WAHTOPANAH NEAR RIVERS,MB,4,A,,50.0296592712402,-100.20336151123,3890.0,,0,1,1020,647,35
05MF021,LITTLE SASKATCHEWAN RIVER NEAR RAPID CITY,MB,4,D,,50.1083297729492,-100.116668701172,3460.0,,0,0,,,
05MF022,JACKFISH CREEK AT OUTLET OF MOON LAKE,MB,4,D,,50.8722190856934,-100.046669006348,17.0,,0,0,,,
05MF023,MOON LAKE NEAR WASAGAMING,MB,4,D,,50.8736114501953,-100.049438476563,17.0,,0,0,,,35
05MF024,LITTLE SASKATCHEWAN RIVER NEAR HOROD,MB,4,A,,50.689998626709,-100.24893951416,994.0,,0,1,1020,647,10
05MF025,CLEAR CREEK BELOW OUTLET FROM CLEAR LAKE,MB,4,D,,50.6791687011719,-100.063331604004,,,0,0,647,647,10
05MF026,BOGEY CREEK AT THE WISHING WELL,MB,4,D,,50.6749992370605,-99.913330078125,,,0,0,647,647,10
05MF801,LITTLE SASKATCHEWAN RIVER ABOVE RAPID CITY DAM,MB,4,A,,50.121940612793,-100.04167175293,3230.0,,0,0,1020,1020,35
05MF803,RIVERS RESERVOIR NEAR RIVERS,MB,4,D,,50.0222206115723,-100.20027923584,3890.0,,0,0,390,390,35
05MF804,NORTH THOMAS LAKE NEAR SANDY LAKE,MB,4,A,,50.5986099243164,-100.239166259766,40.7000007629395,16.2999992370605,0,0,1020,1020,174
05MG001,ARROW RIVER NEAR ARROW RIVER,MB,4,A,,50.0928802490234,-100.955688476563,606.0,,0,1,1020,647,10
05MG002,BOSSHILL CREEK NEAR VIRDEN,MB,4,D,,49.8427810668945,-100.967216491699,187.0,,0,0,,,
05MG003,GOPHER CREEK NEAR VIRDEN,MB,4,A,,49.7834396362305,-100.96639251709,301.0,,0,1,1020,647,10
05MG004,OAK RIVER NEAR RIVERS,MB,4,A,,50.0257797241211,-100.394271850586,1170.0,,0,1,1020,647,10
05MG005,HAMIOTA CREEK NEAR HAMIOTA,MB,4,D,,50.1805610656738,-100.558326721191,51.5999984741211,,0,0,,,
05MG006,KENTON CREEK AT KENTON,MB,4,D,,49.9900016784668,-100.610832214355,42.5999984741211,,0,0,390,647,10
05MG007,SHOAL LAKE AT SHOAL LAKE,MB,4,D,,50.4338912963867,-100.598609924316,409.0,,0,0,390,647,179
05MG008,OAK RIVER AT SHOAL LAKE,MB,4,D,,50.4425010681152,-100.587783813477,362.0,,0,0,390,647,10
05MG009,ARROW RIVER NEAR KELLOE,MB,4,D,,50.4180603027344,-100.817222595215,6.90000009536743,1.70000004768372,0,0,,,10
05MG010,OAK RIVER NEAR BRADWARDINE,MB,4,D,,49.9249992370605,-100.462783813477,1860.0,,0,0,,,
05MG011,HALES CREEK NEAR HARDING,MB,4,D,,49.9127807617188,-100.507217407227,125.0,,0,0,,,
05MG012,OAK RIVER NEAR OUTLET OF RAVEN LAKE,MB,4,D,,50.3263893127441,-100.599998474121,445.0,,0,0,,,10
05MG013,ASSINIBOINE RIVER NORTH OF GRISWOLD,MB,4,A,,49.8430595397949,-100.462783813477,89200.0,,0,1,1020,647,10
05MG014,ASSINIBOINE RIVER EAST OF VIRDEN,MB,4,A,,49.8752784729004,-100.848892211914,86604.0,,0,1,1020,647,10
05MG015,BAILEYS CREEK NEAR OAK LAKE,MB,4,A,,49.8606109619141,-100.667640686035,85.8000030517578,,0,1,1020,647,10
05MG801,ASSINIBOINE RIVER NEAR GRISWOLD,MB,4,D,,49.8433303833008,-100.459999084473,89200.0,,0,0,390,390,35
05MG802,ASSINIBOINE RIVER NEAR VIRDEN,MB,4,A,,49.8411102294922,-100.815826416016,86604.0,,0,0,1020,1020,35
05MG803,KENTON RESERVOIR NEAR KENTON,MB,4,A,,49.9755592346191,-100.607780456543,117.0,,0,0,1020,1020,35
05MH001,ASSINIBOINE RIVER AT BRANDON,MB,4,A,,49.8614387512207,-99.9615783691406,93800.0,,0,1,647,647,200
05MH002,CYPRESS RIVER AT CYPRESS RIVER,MB,4,D,,49.5499992370606,-99.0749969482422,377.0,,0,0,,,10
05MH004,CYPRESS RIVER NEAR CYPRESS RIVER,MB,4,D,,49.5919418334961,-99.033332824707,632.0,,0,0,390,647,10
05MH005,ASSINIBOINE RIVER NEAR HOLLAND,MB,4,A,D,49.6986389160156,-98.8895568847656,160000.0,,0,1,1020,647,35
05MH006,LITTLE SOURIS RIVER NEAR BRANDON,MB,4,A,,49.7321701049805,-99.8488616943359,644.0,,0,1,1020,647,10
05MH007,EPINETTE CREEK NEAR CARBERRY,MB,4,A,,49.741828918457,-99.3251190185547,382.0,,0,1,1020,647,10
05MH008,CYPRESS RIVER NEAR BRUXELLES,MB,4,A,,49.4463882446289,-98.9079971313477,276.0,,0,1,1020,647,10
05MH011,WILLOW CREEK NEAR CHATER,MB,4,D,,49.8588905334473,-99.8261108398438,666.0,,0,0,390,647,10
05MH013,ASSINIBOINE RIVER NEAR BRANDON,MB,4,D,D,49.8705787658691,-100.100028991699,93700.0,,0,0,647,647,129
05MJ001,ASSINIBOINE RIVER AT HEADINGLEY,MB,4,A,D,49.868278503418,-97.4052810668945,162000.0,,0,1,1020,647,129
05MJ002,ASSINIBOINE RIVER AT ST. JAMES,MB,4,D,,49.875,-97.1916732788086,163000.0,,0,0,,,
05MJ003,ASSINIBOINE RIVER NEAR PORTAGE LA PRAIRIE,MB,4,A,D,49.9377784729004,-98.2737197875977,161000.0,,0,1,1020,647,129
05MJ004,STURGEON CREEK AT ST. JAMES,MB,4,A,,49.8817481994629,-97.2798309326172,556.0,,0,1,1020,647,10
05MJ005,ASSINIBOINE RIVER NEAR ROSSENDALE,MB,4,D,D,49.7588882446289,-98.6422195434571,161000.0,,0,0,,,
05MJ006,PORTAGE RESERVOIR NEAR PORTAGE LA PRAIRIE,MB,4,A,,49.9444198608398,-98.336669921875,161000.0,,0,1,1020,647,68
05MJ007,OMANDS CREEK NEAR METRO ROUTE 90,MB,4,D,,49.9119415283203,-97.2055587768555,74.8000030517578,,0,0,,647,10
05MJ008,OMANDS CREEK NEAR BROOKSIDE CEMETERY,MB,4,D,,49.9166717529297,-97.2163925170898,70.5999984741211,70.5999984741211,0,0,,,35
05MJ009,TRURO CREEK AT WESTERN AIRPORT BOUNDARY,MB,4,D,,49.9094390869141,-97.2638931274414,7.69999980926514,,0,0,,,35
05MJ010,TRURO CREEK NEAR ASSINIBOINE GOLF COURSE,MB,4,D,,49.8883285522461,-97.227783203125,14.6999998092651,,0,0,,,35
05MJ011,STURGEON CREEK NEAR PERIMETER HIGHWAY,MB,4,D,,49.9161109924316,-97.3258285522461,524.0,,0,0,390,647,10
05MJ012,ASSINIBOINE RIVER AT BAIE ST. PAUL,MB,4,A,,50.0120582580566,-97.7608337402344,162000.0,,0,1,1020,647,158
05MJ013,OMANDS CREEK NEAR EMPRESS STREET EAST,MB,4,A,,49.8842506408691,-97.1946716308594,79.8000030517578,,0,1,1020,647,10
05MJ802,GRANTS LAKE ABOVE GRANTS DAM,MB,4,A,,50.0586090087891,-97.5491714477539,,,0,0,1020,1020,35
05NA001,LONG CREEK NEAR TRIBUNE,SK,8,D,,49.2180595397949,-103.888893127441,1970.0,801.0,0,0,,,
05NA002,LONG CREEK NEAR TRIBUNE,SK,8,D,,49.1755599975586,-103.843887329102,1980.0,827.0,0,0,,,10
05NA003,LONG CREEK AT WESTERN CROSSING OF INTERNATIONAL BOUNDARY,SK,8,A,D,49.0000801086426,-103.352561950684,3210.0,1210.0,0,1,647,647,10
05NA004,LONG CREEK NEAR MAXIM,SK,8,A,D,49.2588882446289,-103.956108093262,1790.0,724.0,0,0,1010,1010,10
05NA005,GIBSON CREEK NEAR RADVILLE,SK,8,A,,49.4841690063477,-104.337501525879,528.0,142.0,0,1,1010,647,10
05NA006,LARSEN RESERVOIR NEAR RADVILLE,SK,8,A,,49.475170135498,-104.281692504883,24.6000003814697,22.2999992370605,0,1,647,647,35
05NA007,MAXIM LAKE (RESERVOIR) NEAR MAXIM,SK,8,D,,49.3175010681152,-103.969169616699,,,0,0,,,35
05NA009,RADVILLE INDEX RESERVOIR,SK,8,D,,49.5263900756836,-104.280563354492,3.36999988555908,3.36999988555908,0,0,647,647,10
05NB001,LONG CREEK NEAR ESTEVAN,SK,8,A,,49.1020812988281,-103.016967773438,4840.0,1490.0,0,1,647,647,35
05NB004,BEAVERDAM CREEK NEAR WEYBURN,SK,8,D,,49.5972213745117,-103.965278625488,241.0,,0,0,,,
05NB005,TATAGWA LAKE NEAR WEYBURN,SK,8,D,,49.6441688537598,-103.996940612793,,192.0,0,0,,,10
05NB006,SOURIS RIVER NEAR MIDALE,SK,8,D,,49.3791694641113,-103.593063354492,4010.0,2010.0,0,0,,,
05NB007,SOURIS RIVER NEAR ESTEVAN,SK,8,D,,49.0997200012207,-102.937217712402,11300.0,4090.0,0,0,,,
05NB008,SHORT CREEK NEAR ROCHE PERCEE,SK,8,D,,49.0625,-102.818061828613,1230.0,339.0,0,0,,,
05NB009,SOURIS RIVER NEAR ROCHE PERCEE,SK,8,D,D,49.0761108398438,-102.764717102051,13400.0,4520.0,0,0,556,647,10
05NB010,SOURIS RIVER NEAR MACOUN,SK,8,D,,49.1986083984375,-103.261108398438,5230.0,2430.0,0,0,,,
05NB011,YELLOW GRASS DITCH NEAR YELLOW GRASS,SK,8,A,D,49.7863883972168,-104.039672851563,2650.0,648.0,0,1,647,647,10
05NB012,BOUNDARY RESERVOIR NEAR ESTEVAN,SK,8,A,,49.0969390869141,-103.024436950684,4840.0,1500.0,0,0,1010,1010,178
05NB013,LONG CREEK AT EASTERN CROSSING OF INTERNATIONAL BOUNDARY,SK,8,D,,49.0180587768555,-103.060279846191,4510.0,1450.0,0,0,,,
05NB014,JEWEL CREEK NEAR GOODWATER,SK,8,A,D,49.3858299255371,-103.711936950684,211.0,192.0,0,1,1010,647,10
05NB015,ROUGHBARK CREEK ABOVE ROUGHBARK RESERVOIR,SK,8,D,,49.4941711425781,-103.765556335449,156.0,111.0,0,0,,,10
05NB016,ROUGHBARK RESERVOIR NEAR WEYBURN,SK,8,A,,49.5012512207031,-103.719749450684,179.0,124.0,0,1,647,647,35
05NB017,SOURIS RIVER NEAR HALBRITE,SK,8,D,D,49.4936103820801,-103.662216186523,3950.0,1500.0,0,0,1004,647,10
05NB018,TATAGWA LAKE DRAIN NEAR WEYBURN,SK,8,A,,49.5998611450195,-103.947998046875,240.0,195.0,0,1,647,647,10
05NB019,"COULEE, WEST OF BOUNDARY RESERVOIR NEAR ESTEVAN",SK,8,D,,49.0855598449707,-103.073059082031,137.0,14.0,0,0,,,
05NB020,NICKLE LAKE NEAR WEYBURN,SK,8,A,,49.5753898620606,-103.769279479981,3700.0,1340.0,0,1,647,647,35
05NB021,SHORT CREEK NEAR ROCHE PERCEE,SK,8,A,D,49.03125,-102.849609375,1210.0,325.0,0,1,647,647,10
05NB022,DEAD LAKE RESERVOIR NEAR MIDALE,SK,8,D,,49.2897186279297,-103.444442749023,5450.0,2250.0,0,0,647,647,35
05NB023,ROUGHBARK CREEK BELOW ROUGHBARK RESERVOIR,SK,8,D,,49.4936103820801,-103.70361328125,254.0,182.0,0,0,,,
05NB024,WEYBURN INDEX RESERVOIR,SK,8,D,,49.5616683959961,-103.674438476563,29.5,23.6000003814697,0,0,647,647,10
05NB025,SOURIS RIVER NEAR LEWVAN,SK,8,D,,49.9769401550293,-104.075828552246,590.0,200.0,0,0,,,10
05NB026,LONG CREEK NEAR CROSBY,ND,8,D,,48.9749984741211,-103.267776489258,3370.0,1260.0,0,0,,,
05NB027,LONG CREEK NEAR NOONAN,ND,8,A,,48.9811096191406,-103.076110839844,4460.0,1440.0,0,0,600,600,10
05NB028,SOURIS RIVER AT WEYBURN,SK,8,D,,49.6569404602051,-103.859718322754,2240.0,876.0,0,0,,,
05NB029,DEAD LAKE PROJECT - SOURIS RIVER CHANNEL,SK,8,D,,49.2897186279297,-103.444442749023,5450.0,2250.0,0,0,647,647,35
05NB030,SOURIS RIVER NEAR MCTAGGART,SK,8,D,,49.7694396972656,-104.015556335449,2770.0,737.0,0,0,556,556,10
05NB031,SOURIS RIVER NEAR BECHARD,SK,8,A,,49.9888916015625,-104.190002441406,1831.0,435.0,0,0,1010,1010,10
05NB032,RAFFERTY RESERVOIR NEAR ESTEVAN,SK,8,A,,49.145580291748,-103.094612121582,6190.0,2110.0,0,1,647,647,35
05NB033,MOSELEY CREEK NEAR HALBRITE,SK,8,A,,49.4948310852051,-103.629577636719,58.5,35.2000007629395,0,1,647,647,10
05NB034,ROUGHBARK CREEK NEAR GOODWATER,SK,8,D,,49.436939239502,-103.673606872559,288.0,204.0,0,0,647,647,10
05NB035,COOKE CREEK NEAR GOODWATER,SK,8,A,,49.3526382446289,-103.614028930664,129.0,65.8000030517578,0,1,647,647,10
05NB036,SOURIS RIVER BELOW RAFFERTY RESERVOIR,SK,8,A,,49.1433906555176,-103.083106994629,6200.0,2510.0,0,1,647,647,10
05NB037,UNNAMED RESERVOIR NEAR GOODWATER,SK,8,D,,49.336669921875,-103.541107177734,5047.0,2170.0,0,0,647,647,35
05NB038,BOUNDARY RESERVOIR DIVERSION CANAL NEAR ESTEVAN,SK,8,A,,49.1481704711914,-103.11213684082,,,0,1,647,647,10
05NB039,TRIBUTARY NEAR OUTRAM,SK,8,A,,49.1740798950195,-103.301307678223,94.4000015258789,18.8999996185303,0,0,647,647,10
05NB040,SOURIS RIVER NEAR RALPH,SK,8,A,,49.5312194824219,-103.67749786377,3890.0,,0,1,647,647,10
05NB041,ROUGHBARK CREEK ABOVE RAFFERTY RESERVOIR,SK,8,A,,49.464168548584,-103.684440612793,269.0,,0,1,647,647,10
05NC001,MOOSE MOUNTAIN CREEK BELOW MOOSE MOUNTAIN LAKE,SK,8,A,,49.8730583190918,-103.014999389648,2310.0,772.0,0,0,1010,1010,10
05NC002,MOOSE MOUNTAIN LAKE (RESERVOIR) NEAR CORNING,SK,8,A,,49.8925285339355,-103.03044128418,1990.0,606.0,0,1,647,647,90
05NC003,MOOSE MOUNTAIN CREEK ABOVE KISBEY IRRIGATION PROJECT,SK,8,D,,49.685001373291,-102.796112060547,3290.0,1070.0,0,0,,,
05NC004,MOOSE MOUNTAIN CREEK BELOW KISBEY IRRIGATION PROJECT,SK,8,D,,49.6172218322754,-102.592498779297,3600.0,1230.0,0,0,,,
05NC005,MOOSE MOUNTAIN CREEK NEAR GLENAVON,SK,8,D,,50.1055603027344,-103.140281677246,1020.0,261.0,0,0,,,
05NC006,ARCOLA INDEX RESERVOIR,SK,8,D,,49.702220916748,-102.568328857422,1.39999997615814,1.39999997615814,0,0,647,647,10
05ND001,SOURIS RIVER NEAR GLEN EWEN,SK,8,D,D,49.1838912963867,-102.028327941895,22800.0,7220.0,0,0,647,647,10
05ND003,SOURIS RIVER NEAR OXBOW,SK,8,D,,49.2152786254883,-102.170562744141,21900.0,7120.0,0,0,,,10
05ND004,MOOSE MOUNTAIN CREEK NEAR OXBOW,SK,8,D,D,49.2322807312012,-102.22794342041,6050.0,2170.0,0,0,1004,647,10
05ND006,FROBISHER INDEX RESERVOIR,SK,8,D,,49.1963882446289,-102.376670837402,5.51999998092651,1.78999996185303,0,0,647,647,10
05ND007,SOURIS RIVER NEAR SHERWOOD,ND,8,A,,48.9900016784668,-101.957778930664,23100.0,7440.0,0,0,600,600,10
05ND008,WHITE BEAR (CARLYLE) LAKE NEAR CARLYLE,SK,8,A,,49.7599983215332,-102.279441833496,183.0,38.5999984741211,0,0,1010,1010,82
05ND009,KENOSEE LAKE NEAR CARLYLE,SK,8,A,,49.8311080932617,-102.292503356934,141.0,66.3000030517578,0,0,1010,1010,35
05ND010,MOOSE MOUNTAIN CREEK ABOVE GRANT DEVINE LAKE,SK,8,A,,49.5227813720703,-102.171943664551,4710.0,1940.0,0,1,647,647,10
05ND011,SHEPHERD CREEK NEAR ALAMEDA,SK,8,A,,49.3470001220703,-102.255752563477,175.0,60.0999984741211,0,1,647,647,10
05ND012,GRANT DEVINE LAKE NEAR ALAMEDA,SK,8,A,,49.2589988708496,-102.230781555176,6040.0,2260.0,0,1,647,647,35
05ND013,MOOSE MOUNTAIN CREEK BELOW GRANT DEVINE LAKE,SK,8,A,,49.2480316162109,-102.229309082031,6050.0,2170.0,0,1,1010,647,10
05NE001,PIPESTONE CREEK NEAR MOOSOMIN,SK,8,D,D,50.0444412231445,-101.675827026367,3650.0,1220.0,0,0,556,647,10
05NE002,MOOSOMIN LAKE NEAR MOOSOMIN,SK,8,A,,50.0500793457031,-101.690032958984,3640.0,1210.0,0,1,647,647,35
05NE003,PIPESTONE CREEK ABOVE MOOSOMIN LAKE,SK,8,A,,50.1521911621094,-101.837028503418,2730.0,655.0,0,1,647,647,12
05NF001,SOURIS RIVER AT MELITA,MB,4,A,,49.2666702270508,-100.977081298828,49900.0,,0,1,1020,647,200
05NF002,ANTLER RIVER NEAR MELITA,MB,4,A,D,49.0573883056641,-101.049278259277,3220.0,,1,1,1020,647,10
05NF003,GAINSBOROUGH CREEK NEAR MELITA,MB,4,D,,49.163890838623,-101.046112060547,1510.0,,0,0,,,
05NF006,LIGHTNING CREEK NEAR CARNDUFF,SK,8,A,,49.221061706543,-101.718971252441,748.0,393.0,1,0,1010,647,10
05NF007,GAINSBOROUGH CREEK NEAR LYLETON,MB,4,A,,49.0949211120605,-101.182891845703,1150.0,,0,1,1020,647,10
05NF008,GRAHAM CREEK NEAR MELITA,MB,4,A,,49.2626113891602,-100.998077392578,741.0,,0,1,1020,647,129
05NF009,SOURIS RIVER NEAR MELITA,MB,4,D,,49.1722183227539,-101.029998779297,49000.0,,0,0,,,35
05NF010,ANTLER RIVER NEAR WAUCHOPE,SK,8,A,D,49.5839195251465,-101.848167419434,348.0,133.0,1,1,1010,647,110
05NF011,WASKADA CREEK NORTH OF CRANMER,MB,4,D,,49.1183280944824,-100.688888549805,97.6999969482422,79.5999984741211,0,0,,,10
05NF012,SOURIS RIVER NEAR WESTHOPE,ND,4,A,D,48.9963912963867,-100.958061218262,43700.0,,0,1,647,600,10
05NF013,GAINSBOROUGH CREEK NEAR STORTHOAKS,SK,8,D,D,49.4141693115234,-101.526672363281,716.0,395.0,0,0,556,647,10
05NF014,WASKADA CREEK NEAR CRANMER,MB,4,D,,49.1277809143066,-100.713890075684,109.0,,0,0,390,647,10
05NF015,JACKSON CREEK NEAR MELITA,MB,4,D,,49.2999992370605,-100.963890075684,448.0,,0,0,647,647,10
05NF016,SOURIS RIVER NEAR COULTER,MB,4,D,D,49.0908317565918,-100.953330993652,43900.0,,0,0,647,647,35
05NF803,SOURIS RIVER NEAR MELITA (PTH NO. 3),MB,4,D,,49.2663917541504,-100.970832824707,49900.0,,0,0,390,390,35
05NF804,METIGOSHE LAKE NEAR METIGOSHE,MB,4,A,,49.0005607604981,-100.365829467773,166.0,,0,0,1020,1020,174
05NF805,SHARPE LAKE NEAR DELORAINE,MB,4,A,,49.0436096191406,-100.326667785645,21.7999992370605,,0,0,1020,390,35
05NG001,SOURIS RIVER AT WAWANESA,MB,4,A,D,49.5969390869141,-99.6786422729492,61100.0,,0,1,1020,647,154
05NG003,PIPESTONE CREEK NEAR PIPESTONE,MB,4,A,,49.5960311889649,-100.962860107422,4240.0,,0,1,1020,647,10
05NG004,STONY CREEK NEAR BEDE,MB,4,D,,49.4552803039551,-100.962219238281,599.0,,0,0,,,
05NG007,PLUM CREEK NEAR SOURIS,MB,4,A,,49.6258316040039,-100.303421020508,5420.0,,0,1,1020,647,128
05NG010,OAK CREEK NEAR STOCKTON,MB,4,A,,49.5621109008789,-99.5123291015625,1030.0,,0,1,1020,647,200
05NG011,TURTLEHEAD CREEK NEAR DELORAINE,MB,4,D,,49.1883316040039,-100.434173583984,92.4000015258789,,0,0,,,
05NG012,ELGIN CREEK NEAR SOURIS,MB,4,A,,49.5902481079102,-100.235687255859,530.0,,0,1,1020,647,10
05NG016,TURTLEHEAD CREEK ABOVE DELORAINE RESERVOIR,MB,4,D,,49.1341705322266,-100.401138305664,75.0,,0,0,647,647,10
05NG017,TURTLEHEAD CREEK BELOW DELORAINE RESERVOIR,MB,4,D,,49.1619415283203,-100.417503356934,79.5999984741211,79.5999984741211,0,0,,,
05NG019,STONY CREEK NEAR BROOMHILL,MB,4,A,,49.3977813720703,-101.098327636719,460.0,,0,1,1020,647,10
05NG020,MEDORA CREEK NEAR NAPINKA,MB,4,A,,49.3258285522461,-100.703689575195,998.0,,0,1,1020,647,10
05NG021,SOURIS RIVER AT SOURIS,MB,4,A,,49.6196899414062,-100.245941162109,59400.0,,0,1,1020,647,154
05NG022,MAPLE LAKE NEAR PIPESTONE,MB,4,D,,49.5038909912109,-100.816108703613,1200.0,,0,0,390,647,35
05NG023,WHITEWATER LAKE NEAR BOISSEVAIN,MB,4,A,,49.2226409912109,-100.262641906738,684.0,674.0,0,1,1020,647,200
05NG024,PIPESTONE CREEK NEAR THE SASKATCHEWAN BOUNDARY,MB,4,A,,49.8417510986328,-101.39778137207,3900.0,1340.0,0,1,647,647,10
05NG025,SOURIS RIVER NEAR LAUDER,MB,4,D,D,49.4000015258789,-100.760276794434,53100.0,,0,0,,,35
05NG026,SOURIS RIVER NEAR MINTO,MB,4,D,D,49.5008316040039,-99.9891662597656,,,0,0,,,
05NG027,OAK CREEK NEAR GLENBORO,MB,4,D,,49.4894409179688,-99.1711120605469,493.0,,0,0,390,647,10
05NG028,OAK CREEK NEAR CYPRESS RIVER,MB,4,D,,49.4777793884277,-99.1555633544922,429.0,,0,0,,,10
05NG801,PLUM LAKES ABOVE DELEAU DAM,MB,4,A,,49.607780456543,-100.640281677246,5180.0,,0,0,1020,1020,35
05NG803,ELGIN RESERVOIR NEAR ELGIN,MB,4,A,,49.439998626709,-100.243606567383,154.0,,0,0,1020,1020,35
05NG806,SOURIS RIVER ABOVE HARTNEY DAM,MB,4,D,,49.4933280944824,-100.532218933105,53700.0,,0,0,1020,1020,35
05NG807,SOURIS RIVER ABOVE NAPINKA DAM,MB,4,A,,49.3772201538086,-100.798057556152,51800.0,,0,0,1020,1020,35
05NG809,PLUM LAKES NEAR FINDLAY,MB,4,A,,49.6100006103516,-100.71305847168,5180.0,,0,0,1020,1020,35
05NG810,COATSTONE RESERVOIR NEAR DELORAINE,MB,4,A,,49.1502799987793,-100.446670532227,4.69999980926514,,0,0,1020,1020,35
05NG813,OAK LAKE AT OAK LAKE RESORT,MB,4,A,,49.690559387207,-100.716941833496,4810.0,,0,0,1020,1020,169
