STATION_NUMBER,STATION_NAME,PROV_TERR_STATE_LOC,REGIONAL_OFFICE_ID,HYD_STATUS,SED_STATUS,LATITUDE,LONGITUDE,DRAINAGE_AREA_GROSS,DRAINAGE_AREA_EFFECT,RHBN,REAL_TIME,CONTRIBUTOR_ID,OPERATOR_ID,DATUM_ID
08KD003,WILLOW RIVER NEAR WILLOW RIVER,BC,2,D,,54.0686111450195,-122.463890075684,3110.0,,0,0,,,10
08KD004,BOWRON RIVER NEAR HANSARD,BC,2,D,,54.0361099243164,-121.879173278809,3550.0,,0,0,,,10
08KD005,BOWRON LAKE NEAR WELLS,BC,2,D,,53.2583312988281,-121.413887023926,,,0,0,,,10
08KD006,WILLOW RIVER ABOVE HAY CREEK,BC,2,D,,54.0455589294434,-122.373062133789,2860.0,,0,0,55,647,10
08KD007,BOWRON RIVER BELOW BOX CANYON,BC,2,A,,54.0169410705566,-122.10285949707,3330.0,,0,1,647,647,10
08KE001,FRASER RIVER AT PRINCE GEORGE,BC,2,D,,53.9124984741211,-122.711669921875,79500.0,,0,0,,,161
08KE002,FRASER RIVER AT QUESNEL,BC,2,D,,52.9744415283203,-122.496940612793,97900.0,,0,0,,647,10
08KE003,NARCOSLI CREEK NEAR QUESNEL,BC,2,D,,52.8238906860352,-122.468330383301,1540.0,,0,0,,,
08KE004,LIGHTNING CREEK AT WINGDAM,BC,2,D,,53.0497207641602,-121.958061218262,204.0,,0,0,,,
08KE005,CUISSON CREEK NEAR ALEXANDRIA,BC,2,D,,52.6069412231445,-122.465278625488,162.0,,0,0,,,10
08KE006,AUSTRALIAN CREEK AT AUSTRALIAN,BC,2,D,,52.7211112976074,-122.443061828613,164.0,,0,0,55,55,10
08KE008,CUISSON CREEK (SOUTH FORK) NEAR MARGUERITE,BC,2,D,,52.5180587768555,-122.327781677246,,,0,0,,,
08KE009,COTTONWOOD RIVER NEAR CINEMA,BC,2,D,,53.1552810668945,-122.476112365723,1910.0,,0,0,55,647,10
08KE014,NAVER CREEK AT HIXON,BC,2,D,,53.4263916015625,-122.588890075684,658.0,,0,0,,,10
08KE015,CALE CREEK NEAR RED ROCK,BC,2,D,,53.7566719055176,-122.64778137207,188.0,,0,0,,,10
08KE016,BAKER CREEK AT QUESNEL,BC,2,A,,52.9738883972168,-122.509437561035,1550.0,,1,1,647,647,10
08KE017,KERSLEY CREEK NEAR QUESNEL,BC,2,D,,52.8055610656738,-122.415283203125,37.5999984741211,,0,0,,,10
08KE018,FRASER RIVER AT SOUTH FORT GEORGE,BC,2,A,,53.9007797241211,-122.734939575195,79900.0,,0,1,55,647,10
08KE019,HODSON CREEK NEAR NARCOSLI CREEK,BC,2,D,,52.711109161377,-122.515281677246,,,0,0,,,
08KE020,BOUCHIE CREEK ABOVE BOUCHIE LAKE,BC,2,D,,53.0361099243164,-122.634719848633,,,0,0,,,10
08KE022,SOUTH SISTERS CREEK AT HIGHWAY NO. 97,BC,2,D,,52.8480606079102,-122.410827636719,21.5,,0,0,,,10
08KE023,ALIX CREEK AT OUTLET OF ALIX LAKES,BC,2,D,,52.6347198486328,-122.413612365723,36.2999992370605,,0,0,,,10
08KE024,LITTLE SWIFT RIVER AT THE MOUTH,BC,2,A,,52.9149017333984,-121.767471313477,127.0,,0,1,647,647,10
08KE025,BOUCHIE CREEK BELOW BOUCHIE LAKE,BC,2,D,,53.0255584716797,-122.559722900391,,,0,0,,,10
08KE026,GENERAL CREEK IN ALEXANDRIA I.R. NO. 3,BC,2,D,,52.5908317565918,-122.495002746582,,,0,0,,,10
08KE027,TWAN CREEK BELOW STORAGE DAM,BC,2,D,,52.5305595397949,-122.605560302734,218.0,,0,0,,,10
08KE028,TABOR CREEK AT HIGHWAY NO. 97 NEAR PRINCE GEORGE,BC,2,D,,53.7949981689453,-122.65193939209,113.0,,0,0,,,10
08KE029,LONG JOHN CREEK AT THE MOUTH,BC,2,D,,52.8111114501953,-123.022216796875,169.0,,0,0,,,10
08KE030,SISTERS CREEK BELOW DALE LAKE,BC,2,D,,52.8699989318848,-122.392776489258,16.1000003814697,,0,0,,,10
08KE031,GENERAL CREEK ABOVE DIVERSION,BC,2,D,,52.5902786254883,-122.533332824707,,,0,0,,,10
08KE032,TABOR CREEK ABOVE SWEDE CREEK,BC,2,D,,53.8624992370606,-122.570556640625,60.2000007629395,,0,0,55,647,10
08KE033,ALIX CREEK ABOVE ALIX LAKES,BC,2,D,,52.6369400024414,-122.405563354492,37.2999992370605,,0,0,,647,10
08KE034,DESERTERS CREEK ABOVE NARCOSLI CREEK,BC,2,D,,52.8311080932617,-122.540283203125,99.0999984741211,,0,0,,647,10
08KE035,NARCOSLI CREEK ABOVE RAMSEY CREEK,BC,2,D,,52.4949989318848,-122.755828857422,173.0,,0,0,55,55,10
08KE036,NARCOSLI CREEK BELOW RAMSEY CREEK,BC,2,D,,52.5080604553223,-122.678611755371,629.0,,0,0,55,55,10
08KE037,CUISSON CREEK (EAST FORK) ABOVE DAM,BC,2,D,,52.5811080932617,-122.269172668457,7.80000019073486,,0,0,55,55,10
08KF001,NAZKO RIVER ABOVE MICHELLE CREEK,BC,2,D,,52.9291687011719,-123.547218322754,3240.0,,0,0,,647,10
08KG001,WEST ROAD RIVER NEAR CINEMA,BC,2,A,,53.3064193725586,-122.891807556152,12400.0,,0,1,647,647,10
08KG003,BAEZAEKO RIVER AT LOT 10262,BC,2,D,,52.9861106872559,-123.802780151367,992.0,,0,0,,647,10
08KG004,CHARLESON CREEK AT THE MOUTH,BC,2,D,,53.2969398498535,-122.951942443848,145.0,,0,0,,,10
08KH001,QUESNEL RIVER AT LIKELY,BC,2,A,,52.6158294677734,-121.572326660156,5970.0,,0,1,647,647,10
08KH002,CARIBOO RIVER NEAR LIKELY,BC,2,D,,52.6580581665039,-121.474166870117,2560.0,,0,0,,,
08KH003,CARIBOO RIVER BELOW KANGAROO CREEK,BC,2,D,,52.6666717529297,-121.670829772949,3260.0,,0,0,,647,10
08KH004,CARIBOO RIVER NEAR BARKERVILLE,BC,2,D,,52.9777793884277,-121.176391601563,,,0,0,55,55,
08KH005,MATTHEW RIVER NEAR BARKERVILLE,BC,2,D,,52.9925003051758,-121.122779846191,,,0,0,55,55,
08KH006,QUESNEL RIVER NEAR QUESNEL,BC,2,A,,52.8430595397949,-122.225280761719,11500.0,,0,1,647,647,10
08KH007,HORSEFLY RIVER AT HORSEFLY,BC,2,D,,52.3316688537598,-121.412780761719,2310.0,,0,0,,,10
08KH008,LITTLE HORSEFLY RIVER NEAR HORSEFLY,BC,2,D,,52.3730583190918,-121.313606262207,422.0,,0,0,,,10
08KH010,HORSEFLY RIVER ABOVE MCKINLEY CREEK,BC,2,A,,52.291389465332,-121.066940307617,790.0,,0,1,647,647,10
08KH011,QUESNEL LAKE NEAR LIKELY,BC,2,A,,52.5747184753418,-121.540283203125,,,0,1,647,647,10
08KH013,CARIBOO RIVER NEAR KEITHLEY CREEK,BC,2,D,,52.7294387817383,-121.434722900391,2870.0,,0,0,,,10
08KH014,MITCHELL RIVER AT OUTLET OF MITCHELL LAKE,BC,2,D,,52.8433303833008,-120.741668701172,245.0,,0,0,,,10
08KH015,MITCHELL LAKE NEAR KEITHLEY CREEK,BC,2,D,,52.8433303833008,-120.736106872559,,,0,0,,,10
08KH016,DRAGON CREEK AT OUTLET OF DRAGON LAKE,BC,2,D,,52.9741706848145,-122.434997558594,,,0,0,,,10
08KH017,CARIBOO LAKE NEAR KEITHLEY CREEK,BC,2,D,,52.746940612793,-121.42472076416,,,0,0,,,10
08KH018,BARLOW CREEK NEAR QUESNEL,BC,2,D,,53.0258293151856,-122.488327026367,69.9000015258789,,0,0,,,10
08KH019,MOFFAT CREEK NEAR HORSEFLY,BC,2,A,,52.3157196044922,-121.408439636231,548.0,,0,1,647,647,10
08KH020,MCKINLEY CREEK BELOW OUTLET OF MCKINLEY LAKE,BC,2,A,,52.2808303833008,-121.001358032227,431.0,,0,1,647,647,10
08KH021,BEAVER CREEK AT OUTLET OF BEAVER LAKE,BC,2,D,,52.4775009155273,-121.850563049316,847.0,,0,0,,,10
08KH022,MACKAY RIVER AT THE MOUTH,BC,2,D,,52.3738899230957,-120.722221374512,144.0,,0,0,,,10
08KH023,DRAGON CREEK ABOVE DRAGON LAKE,BC,2,D,,52.9533309936523,-122.403610229492,7.25,,0,0,,647,10
08KH024,MOLYBDENITE CREEK NEAR HENDRIX LAKE,BC,2,D,,52.1349983215332,-120.883331298828,,,0,0,,,10
08KH025,LITTLE HORSEFLY RIVER ABOVE GRUHS LAKE,BC,2,D,,52.3655586242676,-121.355278015137,416.0,,0,0,,,10
08KH026,GERIMI CREEK NEAR THE MOUTH,BC,2,D,,52.8477783203125,-122.222503662109,56.7999992370605,,0,0,55,55,10
08KH027,HAZELTINE CREEK BELOW POLLEY LAKE,BC,2,D,,52.5127792358398,-121.571113586426,,,0,0,,647,10
08KH028,RUDY CREEK BELOW SANDY LAKE,BC,2,D,,52.6872215270996,-121.781669616699,3.21000003814697,,0,0,55,647,10
08KH029,CAMP CREEK NEAR THE MOUTH,BC,2,D,,52.7830581665039,-120.737777709961,6.28999996185303,,0,0,55,647,10
08KH030,PENFOLD CREEK NEAR THE MOUTH,BC,2,A,,52.7919387817383,-120.749717712402,184.0,,0,1,55,647,10
08KH031,HORSEFLY RIVER ABOVE QUESNEL LAKE,BC,2,A,,52.4443092346191,-121.41813659668,,,0,0,55,647,10
08LA001,CLEARWATER RIVER NEAR CLEARWATER STATION,BC,2,A,D,51.6557197570801,-120.066047668457,10300.0,,1,1,906,647,10
08LA002,HEMP CREEK NEAR RAFT RIVER,BC,2,D,,51.9166717529297,-120.047500610352,177.0,,0,0,,,10
08LA003,MURTLE RIVER NEAR CLEARWATER STATION,BC,2,D,,52.0597190856934,-119.933326721191,1240.0,,0,0,,,10
08LA004,MURTLE RIVER ABOVE DAWSON FALLS,BC,2,D,,51.9794387817383,-120.103607177734,1380.0,,0,0,,,10
08LA005,BRIDGE CREEK NEAR 100 MILE HOUSE,BC,2,D,,51.7050018310547,-121.175827026367,1330.0,,0,0,,647,10
08LA006,CANIM RIVER AT OUTLET OF CANIM LAKE,BC,2,D,,51.8686103820801,-120.597221374512,,,0,0,,,10
08LA007,CLEARWATER RIVER AT OUTLET OF CLEARWATER LAKE,BC,2,D,,52.1388893127441,-120.191673278809,2950.0,,0,0,,647,10
08LA008,MAHOOD RIVER AT OUTLET OF MAHOOD LAKE,BC,2,D,,51.9319381713867,-120.241386413574,4710.0,,0,0,,,10
08LA009,CLEARWATER RIVER AT INLET TO CLEARWATER LAKE,BC,2,D,,52.3486099243164,-120.263893127441,2380.0,,0,0,,,10
08LA010,MAHOOD LAKE NEAR CLEARWATER STATION,BC,2,D,,51.9383316040039,-120.241111755371,,,0,0,,,10
08LA011,CANIM LAKE NEAR CANIM LAKE,BC,2,D,,51.8419418334961,-120.730278015137,,,0,0,,,10
08LA012,CLEARWATER LAKE NEAR CLEARWATER STATION,BC,2,D,,52.1430587768555,-120.191673278809,,,0,0,,647,10
08LA013,CLEARWATER RIVER AT OUTLET OF HOBSON LAKE,BC,2,D,,52.4216690063477,-120.323890686035,904.0,,0,0,,,
08LA014,HOBSON LAKE NEAR CLEARWATER STATION,BC,2,D,,52.4249992370605,-120.325561523438,,,0,0,,,10
08LA015,CANIM CREEK AT OUTLET OF SPOUT LAKE,BC,2,D,,52.0097198486328,-121.444442749023,65.3000030517578,,0,0,,,
08LA016,CANDLE CREEK NEAR CLEARWATER STATION,BC,2,D,,51.6902809143066,-120.004173278809,25.1000003814697,,0,0,,,
08LA017,HORSE LAKE NEAR 100 MILE HOUSE,BC,2,D,,51.6016693115234,-121.192222595215,,,0,0,,,10
08LA018,HOBSON CREEK BELOW BOIS GRENIER CREEK,BC,2,D,,52.6749992370606,-120.102783203125,162.0,,0,0,,,10
08LA019,BOSS CREEK ABOVE HENDRIX CREEK,BC,2,D,,51.9461097717285,-120.704170227051,122.0,,0,0,,,10
08LA020,BRIDGE CREEK AT OUTLET OF HORSE LAKE,BC,2,D,,51.6069412231445,-121.230560302734,912.0,,0,0,,647,10
08LA021,SPAHATS CREEK NEAR THE MOUTH,BC,2,D,,51.7341690063477,-120.007499694824,52.5,,0,0,,647,10
08LA022,BRADLEY CREEK NEAR FOREST GROVE,BC,2,D,,51.8502807617188,-121.025833129883,174.0,,0,0,,,10
08LA023,HENDRIX CREEK BELOW STINSON CREEK,BC,2,D,,52.0411109924316,-120.741386413574,,,0,0,,,10
08LA024,HENDRIX CREEK AT OUTLET OF HENDRIX LAKE,BC,2,D,,52.0916709899902,-120.785827636719,,,0,0,,,10
08LA025,BUFFALO CREEK ABOVE BRIDGE CREEK,BC,2,D,,51.6763916015625,-121.1875,228.0,,0,0,55,55,10
08LA026,LITTLE BRIDGE CREEK ABOVE EXETER LAKE,BC,2,D,,51.6480598449707,-121.375,,,0,0,55,55,10
08LA027,BRIDGE CREEK BELOW DEKA CREEK,BC,2,A,,51.5876083374023,-120.920753479004,,,0,1,55,647,10
08LA028,WINDY CREEK ABOVE JIM CREEK,BC,2,D,,51.6227798461914,-120.672218322754,79.4000015258789,,0,0,55,647,10
08LA029,JUDSON CREEK NEAR THE MOUTH,BC,2,D,,51.5699996948242,-120.798889160156,20.1000003814697,,0,0,278,647,10
08LB001,CAHILTY CREEK NEAR LOUIS CREEK,BC,2,D,,50.9541702270508,-120.027778625488,57.2000007629395,,0,0,,,
08LB003,EDWARDS CREEK NEAR HEFFLEY CREEK,BC,2,D,,50.9055595397949,-120.141670227051,38.9000015258789,,0,0,,,
08LB004,HEFFLEY CREEK NEAR KAMLOOPS,BC,2,D,,50.8611106872559,-120.258331298828,168.0,,0,0,,,
08LB005,HEFFLEY CREEK NEAR HEFFLEY CREEK,BC,2,D,,50.8569412231445,-120.158332824707,72.5,,0,0,,,10
08LB006,HEFFLEY CREEK (ANDERSON DIVERSION) NEAR HEFFLEY CREEK,BC,2,D,,50.8611106872559,-120.258331298828,,,0,0,,,10
08LB007,HEFFLEY CREEK (CRAWSHAW DITCH) NEAR HEFFLEY CREEK,BC,2,D,,50.8611106872559,-120.258331298828,,,0,0,,,
08LB008,JAMIESON CREEK ABOVE BRITISH COLUMBIA FRUITLANDS DIVERSION,BC,2,D,,50.8849983215332,-120.290000915527,230.0,,0,0,,,
08LB009,JAMIESON CREEK BELOW BRITISH COLUMBIA FRUITLANDS DIVERSION,BC,2,D,,50.8833312988281,-120.285003662109,,,0,0,,,
08LB010,LOUIS CREEK AT BOUNDARY OF RAILWAY BELT,BC,2,D,,50.9700012207031,-120.035827636719,269.0,,0,0,,,
08LB011,PAUL CREEK ABOVE PINANTAN LAKE,BC,2,D,,50.7222213745117,-120.0,38.9000015258789,,0,0,,,
08LB012,PAUL CREEK AT THE OUTLET OF PINANTAN LAKE,BC,2,D,,50.7249984741211,-120.032783508301,55.7000007629395,,0,0,647,647,10
08LB013,PAUL CREEK NEAR KAMLOOPS (STATION A),BC,2,D,,50.7388916015625,-120.156936645508,139.0,,0,0,,,
08LB015,NORTH THOMPSON RIVER NEAR BLACK PINES,BC,2,D,,50.8916702270508,-120.254173278809,,,0,0,,,
08LB016,HEFFLEY CREEK AT INLET TO HEFFLEY LAKE,BC,2,D,,50.8166694641113,-120.047218322754,18.1000003814697,,0,0,,,10
08LB017,RAFT RIVER NEAR CLEARWATER,BC,2,D,,51.6388893127441,-119.966667175293,764.0,,0,0,,,10
08LB019,WHITEWOOD CREEK AT HIGHWAY BRIDGE NEAR BLACK PINES,BC,2,D,,51.0625,-120.238891601563,33.7000007629395,,0,0,,,10
08LB020,BARRIERE RIVER AT THE MOUTH,BC,2,A,,51.1880187988281,-120.126541137695,1140.0,,0,1,647,647,10
08LB021,BARRIERE RIVER (EAST FORK) NEAR BARRIERE,BC,2,D,,51.2458305358887,-119.933326721191,155.0,,0,0,,,
08LB022,NORTH THOMPSON RIVER NEAR BARRIERE,BC,2,D,,51.1861114501953,-120.151390075684,17700.0,,0,0,,,10
08LB023,EDWARDS CREEK (LYON'S DIVERSION) NEAR HEFFLEY CREEK,BC,2,D,,50.9013900756836,-120.148612976074,,,0,0,,,10
08LB024,FISHTRAP CREEK NEAR MCLURE,BC,2,A,,51.1220283508301,-120.208938598633,135.0,,0,1,647,647,10
08LB025,KNOUFF CREEK BELOW SULLIVAN LAKE,BC,2,D,,50.9394416809082,-120.189437866211,41.4000015258789,,0,0,,,10
08LB027,PAUL CREEK NEAR KAMLOOPS (STATION F),BC,2,D,,50.7083282470703,-120.319999694824,,,0,0,,,10
08LB028,KNOUFF CREEK AT OUTLET OF SULLIVAN LAKE,BC,2,D,,50.9555587768555,-120.120826721191,25.8999996185303,,0,0,,,10
08LB029,SIWASH CREEK NEAR HEFFLEY LAKE,BC,2,D,,50.8472213745117,-120.094436645508,11.1000003814697,,0,0,,,
08LB030,LEONIE CREEK NEAR BARRIERE,BC,2,D,,51.211669921875,-120.118606567383,25.8999996185303,,0,0,,,10
08LB031,NELSON CREEK NEAR BARRIERE,BC,2,D,,51.25,-120.199996948242,13.0,,0,0,,,
08LB032,PETERSON CREEK NEAR BARRIERE,BC,2,D,,51.1944389343262,-120.163887023926,110.0,,0,0,,,10
08LB033,DUNN CREEK NEAR CHU CHUA,BC,2,D,,51.4102783203125,-120.09944152832,,,0,0,,,10
08LB037,THUNDER RIVER NEAR BLUE RIVER,BC,2,D,,52.223331451416,-119.215278625488,175.0,,0,0,,,10
08LB038,BLUE RIVER NEAR BLUE RIVER,BC,2,A,,52.1166915893555,-119.301940917969,272.0,,0,1,906,647,10
08LB039,MAD RIVER NEAR IRVINE,BC,2,D,,51.6763916015625,-119.60417175293,280.0,,0,0,,,10
08LB040,REG CHRISTIE CREEK NEAR VAVENBY,BC,2,D,,51.5972213745117,-119.66667175293,72.0,,0,0,,,10
08LB041,CHUCK CREEK NEAR VAVENBY,BC,2,D,,51.5888900756836,-119.698608398438,77.6999969482422,,0,0,,,
08LB042,LEMIEUX CREEK NEAR MOUNT OLIE,BC,2,D,,51.4666709899902,-120.216110229492,195.0,,0,0,,,
08LB043,NEHALLISTON CREEK NEAR MOUNT OLIE,BC,2,D,,51.4833297729492,-120.243057250977,155.0,,0,0,,,
08LB044,CHU CHUA CREEK NEAR CHU CHUA,BC,2,D,,51.351390838623,-120.133331298828,31.2000007629395,,0,0,,,10
08LB045,DARLINGTON CREEK NEAR CHINOOK COVE,BC,2,D,,51.3236083984375,-120.183326721191,77.6999969482422,,0,0,,,
08LB046,LINDQUIST CREEK NEAR CHINOOK COVE,BC,2,D,,51.3138885498047,-120.181938171387,77.6999969482422,,0,0,,,10
08LB047,NORTH THOMPSON RIVER AT BIRCH ISLAND,BC,2,A,,51.6018600463867,-119.914352416992,4490.0,,0,1,647,647,10
08LB049,LOUIS CREEK NEAR LOUIS CREEK,BC,2,D,,51.1361083984375,-120.115280151367,515.0,,0,0,,,
08LB050,MANN CREEK NEAR BLACKPOOL,BC,2,D,,51.5761108398438,-120.138328552246,295.0,,0,0,,,10
08LB051,BARRIERE RIVER NEAR BARRIERE (AT DAM),BC,2,D,,51.2374992370606,-120.005561828613,1030.0,,0,0,,,
08LB052,BARRIERE RIVER B.C.E.R. FLUME NEAR BARRIERE,BC,2,D,,51.2333297729492,-120.015281677246,,,0,0,,,
08LB053,PAUL LAKE NEAR KAMLOOPS,BC,2,D,,50.7388916015625,-120.156936645508,,,0,0,,,10
08LB054,PAUL CREEK NEAR KAMLOOPS (STATION B),BC,2,D,,50.7400016784668,-120.190002441406,117.0,,0,0,,,
08LB055,PAUL CREEK NEAR KAMLOOPS (STATION C),BC,2,D,,50.7350006103516,-120.209999084473,222.0,,0,0,,,
08LB056,PAUL CREEK NEAR KAMLOOPS (STATION D),BC,2,D,,50.7255592346191,-120.260002136231,212.0,,0,0,,,
08LB057,PAUL CREEK NEAR KAMLOOPS (STATION E),BC,2,D,,50.7166709899902,-120.276672363281,254.0,,0,0,,,
08LB058,COLD CREEK NEAR KAMLOOPS (UPPER STATION),BC,2,D,,50.7625007629395,-120.202781677246,59.5999984741211,,0,0,,,10
08LB059,COLD CREEK NEAR KAMLOOPS (LOWER STATION),BC,2,D,,50.7425003051758,-120.201393127441,64.8000030517578,,0,0,,,10
08LB060,PAUL CREEK (INDIAN DIVERSION) NEAR KAMLOOPS,BC,2,D,,50.7430610656738,-120.199996948242,,,0,0,,,
08LB061,BADGER CREEK NEAR HEFFLEY CREEK,BC,2,D,,51.0666694641113,-120.14582824707,21.2000007629395,,0,0,,,
08LB062,BADGER CREEK NEAR LOUIS CREEK,BC,2,D,,51.0902786254883,-120.168060302734,29.0,,0,0,,,
08LB064,NORTH THOMPSON RIVER AT MCLURE,BC,2,A,D,51.0409317016602,-120.240463256836,19600.0,,0,1,906,647,10
08LB065,CHRISTIAN CREEK NEAR HEFFLEY CREEK,BC,2,D,,50.8388900756836,-120.009719848633,7.51000022888184,,0,0,,,10
08LB066,HEFFLEY LAKE NEAR HEFFLEY CREEK,BC,2,D,,50.8333282470703,-120.045280456543,,,0,0,,,10
08LB068,BARRIERE RIVER BELOW LEE CREEK,BC,2,D,,51.2805595397949,-119.933326721191,585.0,,0,0,,,
08LB069,BARRIERE RIVER BELOW SPRAGUE CREEK,BC,2,A,,51.2453308105469,-119.937698364258,624.0,,0,0,647,647,10
08LB070,HASCHEAK CREEK BELOW RUSSELL CREEK,BC,2,D,,51.6324996948242,-120.026390075684,24.2999992370605,,0,0,,,10
08LB071,HASCHEAK CREEK ABOVE RUSSELL CREEK,BC,2,D,,51.6291694641113,-120.022216796875,8.02999973297119,,0,0,,,
08LB072,LOUIS CREEK AT THE MOUTH,BC,2,D,,51.1349983215332,-120.122779846191,515.0,,0,0,55,647,10
08LB075,MCDOUGALL CREEK NEAR BIRCH ISLAND,BC,2,D,,51.6058311462402,-119.989723205566,17.8999996185303,,0,0,,,10
08LB076,HARPER CREEK NEAR THE MOUTH,BC,2,A,,51.3543815612793,-119.881637573242,166.0,,1,1,647,647,10
08LB077,BONE CREEK NEAR BLUE RIVER,BC,2,D,,52.2550010681152,-119.178611755371,267.0,,0,0,,,10
08LB078,LEMIEUX CREEK NEAR THE MOUTH,BC,2,A,,51.4275894165039,-120.202041625977,443.0,,0,1,55,647,10
08LB079,AVOLA CREEK (SOUTH FORK) NEAR AVOLA,BC,2,D,,51.7822189331055,-119.326393127441,,,0,0,,,10
08LB081,LOUIS CREEK ABOVE MCGILLIVRAY CREEK,BC,2,D,,50.860279083252,-119.973327636719,,,0,0,55,647,10
08LB082,MCQUEEN LAKE AT THE OUTLET,BC,2,D,,50.8302803039551,-120.4375,,,0,0,906,647,10
08LB083,JAMIESON CREEK ABOVE DIVERSIONS,BC,2,D,,50.8847198486328,-120.287780761719,230.0,,0,0,906,647,10
08LC002,SHUSWAP RIVER NEAR ENDERBY,BC,2,A,,50.5436592102051,-119.012847900391,4720.0,,0,1,55,647,10
08LC003,SHUSWAP RIVER NEAR LUMBY,BC,2,A,,50.3027801513672,-118.81861114502,2000.0,,0,1,75,647,10
08LC004,BRASH CREEK NEAR ENDERBY,BC,2,D,,50.5666694641113,-119.04167175293,32.5999984741211,,0,0,,,10
08LC005,BESSETTE CREEK NEAR LUMBY,BC,2,D,,50.2347183227539,-118.968063354492,253.0,,0,0,,,10
08LC006,DUTEAU CREEK NEAR LAVINGTON,BC,2,D,,50.1974983215332,-119.034439086914,,,0,0,55,647,10
08LC007,VERNON IRRIGATION DISTRICT DIVERSION NEAR LAVINGTON,BC,2,D,,50.1977806091309,-119.034721374512,,,0,0,55,55,10
08LC008,NICKLEN CREEK NEAR LUMBY (LOWER STATION),BC,2,D,,50.1986083984375,-119.002777099609,30.7999992370605,,0,0,,,
08LC009,MCAULEY CREEK NEAR LUMBY,BC,2,D,,50.1577796936035,-118.905563354492,32.5999984741211,,0,0,,,
08LC010,NICKLEN CREEK NEAR LUMBY (UPPER STATION),BC,2,D,,50.1416702270508,-119.015281677246,11.8999996185303,,0,0,,,
08LC014,DUTEAU CREEK AT OUTLET OF HADDO LAKE,BC,2,D,,50.0969390869141,-119.084167480469,81.0999984741211,,0,0,55,55,10
08LC015,PARADISE CREEK NEAR LUMBY,BC,2,D,,50.0666694641113,-118.91667175293,13.5,,0,0,,,
08LC017,DERMONT CREEK NEAR LAVINGTON,BC,2,D,,50.1061096191406,-119.074996948242,,,0,0,,,
08LC018,SHUSWAP RIVER AT OUTLET OF SUGAR LAKE RESERVOIR,BC,2,A,,50.345100402832,-118.547859191895,1130.0,,0,1,75,647,10
08LC019,SHUSWAP RIVER AT OUTLET OF MABEL LAKE,BC,2,D,,50.6027793884277,-118.738327026367,4040.0,,0,0,,,10
08LC020,VIOLET CREEK NEAR GRINDROD (UPPER STATION),BC,2,D,,50.6947212219238,-119.128608703613,13.0,,0,0,,,10
08LC021,LARCH HILLS CREEK NEAR MARA,BC,2,D,,50.7152786254883,-119.04167175293,13.0,,0,0,,,
08LC022,MONASHEE CREEK NEAR CHERRYVILLE,BC,2,D,,50.2194404602051,-118.547500610352,311.0,,0,0,,,
08LC023,HUMMING BIRD CREEK NEAR SICAMOUS,BC,2,D,,50.7666702270508,-119.003326416016,23.2999992370605,,0,0,,,
08LC024,MARA CREEK NEAR SICAMOUS,BC,2,D,,50.7655601501465,-119.003326416016,23.2999992370605,,0,0,,,
08LC025,BLURTON CREEK NEAR MARA,BC,2,D,,50.6791687011719,-119.045829772949,19.2000007629395,,0,0,,,
08LC026,JOHNSON CREEK NEAR MARA,BC,2,D,,50.6994400024414,-119.034721374512,20.7000007629395,,0,0,,,
08LC027,SICAMOUS CREEK NEAR SICAMOUS,BC,2,D,,50.810001373291,-118.968330383301,64.8000030517578,,0,0,,,
08LC028,PTARMIGAN CREEK NEAR MARA,BC,2,D,,50.6661109924316,-119.064437866211,,,0,0,,,
08LC029,BONGARD CREEK NEAR MARA,BC,2,D,,50.6575012207031,-119.069999694824,13.0,,0,0,,,
08LC030,VIOLET CREEK NEAR GRINDROD (LOWER STATION),BC,2,D,,50.6875,-119.122779846191,,,0,0,,,10
08LC031,FORTUNE CREEK AT STEPNEY,BC,2,D,,50.5027809143066,-119.123611450195,132.0,,0,0,,,10
08LC032,SHUSWAP RIVER BELOW SKOOKUMCHUCK RAPIDS,BC,2,D,,50.6111106872559,-118.775001525879,,,0,0,,,10
08LC033,CREIGHTON CREEK NEAR LUMBY,BC,2,D,,50.211109161377,-118.77082824707,37.5999984741211,,0,0,,,10
08LC034,FERRY CREEK NEAR LUMBY,BC,2,D,,50.2419395446777,-118.647216796875,145.0,,0,0,,,10
08LC035,FORTUNE CREEK NEAR ARMSTRONG,BC,2,D,,50.4383316040039,-119.142219543457,41.2000007629395,,0,0,,,10
08LC036,GARDOM CREEK NEAR GRINDROD,BC,2,D,,50.6124992370606,-119.150001525879,25.8999996185303,,0,0,,,
08LC037,MARA LAKE NEAR SICAMOUS,BC,2,D,,50.7763900756836,-119.004440307617,,,0,0,,,10
08LC038,MABEL LAKE AT THE OUTLET,BC,2,D,,50.6027793884277,-118.738327026367,,,0,0,,,10
08LC039,BESSETTE CREEK ABOVE BEAVERJACK CREEK,BC,2,A,,50.2979011535645,-118.859123229981,769.0,,0,1,647,647,10
08LC040,VANCE CREEK BELOW DEAFIES CREEK,BC,2,A,,50.2843208312988,-118.947036743164,70.9000015258789,,0,1,647,647,10
08LC041,SUGAR LAKE RESERVOIR AT THE OUTLET,BC,2,A,,50.3576698303223,-118.538261413574,,,0,1,75,647,10
08LC042,BESSETTE CREEK ABOVE LUMBY LAGOON OUTFALL,BC,2,A,,50.2524681091309,-118.961242675781,632.0,,0,1,647,647,10
08LC043,ABERDEEN LAKE AT THE OUTLET,BC,2,D,,50.1047210693359,-119.073059082031,,,0,0,55,55,10
08LC044,HADDO LAKE AT THE OUTLET,BC,2,D,,50.0944404602051,-119.084167480469,,,0,0,55,55,10
08LC046,CREIGHTON CREEK NEAR CREIGHTON VALLEY,BC,2,D,,50.2102813720703,-118.859169006348,,,0,0,,,10
08LC047,GRIZZLY SWAMP NEAR HADDO LAKE,BC,2,D,,50.0888900756836,-119.08332824707,,,0,0,55,55,10
08LC048,TRINITY CREEK ABOVE DIVERSION,BC,2,D,,50.413890838623,-118.933326721191,42.9000015258789,,0,0,,,10
08LC049,CHERRY CREEK NEAR CHERRYVILLE,BC,2,D,,50.2561111450195,-118.633331298828,503.0,,0,0,,,10
08LC050,TRINITY CREEK NEAR THE MOUTH,BC,2,D,,50.5336112976074,-118.969169616699,191.0,,0,0,,,10
08LD001,ADAMS RIVER NEAR SQUILAX,BC,2,A,,50.9375915527344,-119.656341552734,3210.0,,1,1,55,647,10
08LD002,HIUIHILL CREEK ABOVE DIVERSIONS,BC,2,D,,50.8855590820312,-119.732780456543,69.6999969482422,,0,0,900,647,10
08LD003,ADAMS LAKE NEAR SQUILAX,BC,2,A,,50.9535789489746,-119.675392150879,,,0,1,55,647,10
08LD004,SINMAX CREEK BELOW JOHNSON CREEK,BC,2,D,,51.125,-119.866668701172,130.0,,0,0,,,10
08LD005,HOMESTAKE CREEK NEAR LOUIS CREEK,BC,2,D,,51.1083297729492,-119.827781677246,16.7999992370605,,0,0,,,10
08LD006,HIUIHILL CREEK NEAR SQUILAX (LOWER STATION),BC,2,D,,50.9216690063477,-119.644721984863,104.0,,0,0,,,10
08LD009,FISHER CREEK AT WEST BOUNDARY D.L. 3599,BC,2,D,,51.4255599975586,-119.467781066895,14.6999998092651,,0,0,900,647,10
08LE001,BOLEAN CREEK AT FALKLAND,BC,2,D,,50.5008316040039,-119.561943054199,228.0,,0,0,,,10
08LE002,CAMPBELL CREEK NEAR BARNHART VALE,BC,2,D,,50.6377792358398,-120.122222900391,518.0,,0,0,,,
08LE003,CAMPBELL CREEK NEAR MONTE CREEK,BC,2,D,,50.6522216796875,-120.08332824707,,,0,0,,,
08LE004,CANOE CREEK NEAR SALMON ARM,BC,2,D,,50.7216682434082,-119.227500915527,70.1999969482422,,0,0,,,
08LE005,CHASE CREEK NEAR CHASE,BC,2,D,,50.7972183227539,-119.650833129883,279.0,,0,0,,,
08LE006,PRINGLE CREEK NEAR WESTWOLD,BC,2,D,,50.478889465332,-119.819999694824,15.5,,0,0,,,10
08LE007,EAGLE RIVER NEAR SICAMOUS,BC,2,D,,50.8416709899902,-118.97917175293,1230.0,,0,0,,,10
08LE008,INGRAM CREEK NEAR THE MOUTH,BC,2,D,,50.4566688537598,-119.691673278809,63.2000007629395,,0,0,55,55,10
08LE009,JACKO CREEK NEAR KAMLOOPS,BC,2,D,,50.5988883972168,-120.446670532227,10.8999996185303,,0,0,,,10
08LE010,MARTIN CREEK NEAR PRITCHARD,BC,2,D,,50.6763916015625,-119.759719848633,38.9000015258789,,0,0,,,
08LE011,MONTE CREEK (DIVERSION TO MONTE LAKE) NEAR MONTE LAKE,BC,2,D,,50.5188903808594,-119.856941223145,,,0,0,,,10
08LE012,MONTE CREEK NEAR MONTE LAKE,BC,2,D,,50.5200004577637,-119.85888671875,60.5999984741211,,0,0,,,
08LE013,MONTE CREEK NEAR MONTE CREEK,BC,2,D,,50.6208305358887,-119.922500610352,184.0,,0,0,,,
08LE014,MOULTON CREEK NEAR PRITCHARD,BC,2,D,,50.6833305358887,-119.890281677246,15.5,,0,0,,,
08LE015,NEDS CREEK NEAR PRITCHARD (LOWER STATION),BC,2,D,,50.6672210693359,-119.83943939209,15.5,,0,0,,,10
08LE016,NISKONLITH CREEK NEAR SHUSWAP,BC,2,D,,50.7611083984375,-119.773612976074,130.0,,0,0,,,10
08LE017,PEMBERTON CREEK NEAR PRITCHARD,BC,2,D,,50.7022209167481,-119.862503051758,20.7000007629395,,0,0,,,
08LE018,ROBBINS CREEK NEAR MONTE LAKE (LOWER STATION),BC,2,D,,50.6194381713867,-119.980560302734,38.9000015258789,,0,0,,,
08LE019,SALMON RIVER ABOVE ADELPHI CREEK,BC,2,D,,50.4083290100098,-119.810829162598,546.0,,0,0,55,55,10
08LE020,SALMON RIVER AT FALKLAND,BC,2,A,,50.4985618591309,-119.558609008789,1030.0,,0,1,647,647,10
08LE021,SALMON RIVER NEAR SALMON ARM,BC,2,A,,50.6925086975098,-119.330528259277,1550.0,,0,1,55,647,10
08LE022,ROBBINS CREEK NEAR ROBBINS RANGE,BC,2,D,,50.5750007629395,-120.033332824707,15.5,,0,0,,,
08LE023,WARREN CREEK NEAR SALMON ARM,BC,2,D,,50.4902801513672,-119.529167175293,25.8999996185303,,0,0,,,
08LE024,EAGLE RIVER NEAR MALAKWA,BC,2,A,,50.9363403320313,-118.801651000977,932.0,,0,1,647,647,10
08LE025,CELISTA CREEK NEAR ALBAS,BC,2,D,,51.2083282470703,-119.007499694824,282.0,,0,0,,,10
08LE026,CRAZY CREEK AT TAFT,BC,2,D,,50.9925003051758,-118.643890380859,117.0,,0,0,,,
08LE027,SEYMOUR RIVER NEAR SEYMOUR ARM,BC,2,A,,51.2622184753418,-118.946441650391,805.0,,0,1,647,647,10
08LE028,ONYX CREEK NEAR MAGNA BAY,BC,2,D,,50.9569396972656,-119.293060302734,50.7999992370606,,0,0,,,
08LE029,ROSS CREEK NEAR ANGLEMONT,BC,2,D,,50.9763908386231,-119.227783203125,104.0,,0,0,,,10
08LE030,SCOTCH CREEK NEAR SORRENTO,BC,2,D,,50.9319381713867,-119.465278625488,635.0,,0,0,,,
08LE031,SOUTH THOMPSON RIVER AT CHASE,BC,2,A,,50.763111114502,-119.743118286133,15800.0,,0,1,906,647,10
08LE032,NISKONLITH CREEK ABOVE NISKONLITH LAKE,BC,2,D,,50.7680587768555,-119.800003051758,31.1000003814697,,0,0,,,10
08LE033,LOAKIN CREEK ABOVE INDIAN DIVERSION,BC,2,D,,50.8305587768555,-119.755561828613,51.7999992370605,,0,0,,,
